text,rating,source,brand,doc_id
I still dont get why 85s are NBHD only releases,49,Reddit (r/Sneakers),Nike,RED_1
"I think for many ""Sneakerheads"", the hype is what keeps their attention, and Nike is happy to play into this. 



They'd rather make a handful, and keep people talking than get stuck with warehouses full of them. 



For example, look at Adidas. When Kanye was first teasing Adidas Yeezys, Adidas released the Tubular Runner, or something like that. A rumor was spread that they were the Yeezys. Everyone was so excited for them. Then when they launched, it was a general release, non signature model. All of a sudden everyone went from, ""I need 2 purrr!"" to ""I'll buy em if I get a good deal on em at the end of the year"". And now that Adidas Yeezys are done, while I'm sure that some folks are boycotting anything Kanye related, a lot of people just don't want them cuz the hype is gone or because they got rebranded to just Adidas, no Yeezy affiliation. 



And when Nike released all of the OG colorways in lowtop form back in like 2015, they sat, and I think all of the shoe stores at all of the malls in the city I lived were giving them away for like 50% off.",19,Reddit (r/Sneakers),Nike,RED_2
What does NBHD stand for?,9,Reddit (r/Sneakers),Nike,RED_3
"Neighborhood release, so only select smaller retailers received them",14,Reddit (r/Sneakers),Nike,RED_4
I dont think people wanted these and they didnt want them to sit,7,Reddit (r/Sneakers),Nike,RED_5
Whats NBHD?,3,Reddit (r/Sneakers),Nike,RED_6
"Certain stores will have them in stock but not the normal Finish Line, Etc. Here is a short list of NBHD stores

https://preview.redd.it/kthhqmg4wv6f1.jpeg?width=1170&amp;format=pjpg&amp;auto=webp&amp;s=a752957bead87f3562ec600df82d0550cd8891fe",3,Reddit (r/Sneakers),Nike,RED_7
Nike hates money you havent heard?,1,Reddit (r/Sneakers),Nike,RED_8
rrrrr&.ight. They hate money thats why they have cornered 2/3rds of the global market share.,3,Reddit (r/Sneakers),Nike,RED_9
Nike just prefers scalpers to make 60% more money than they do.. on they own shit. ,1,Reddit (r/Sneakers),Nike,RED_10
"https://preview.redd.it/2x8ef6g1gq6f1.jpeg?width=4028&amp;format=pjpg&amp;auto=webp&amp;s=05135b1c98816c50f7679a744fc95092fde3743b

Great minds on a Friday&",14,Reddit (r/Sneakers),Nike,RED_11
if I didnt already have 17 royals Id go for these asap,14,Reddit (r/Sneakers),Nike,RED_12
You mean you didn't do what this dude did? [https://www.reddit.com/r/Jordans/comments/1l983qu/air\_jordan\_1\_royal\_retro\_low\_85\_retro\_high\_og/](https://www.reddit.com/r/Jordans/comments/1l983qu/air_jordan_1_royal_retro_low_85_retro_high_og/),2,Reddit (r/Sneakers),Nike,RED_13
bro said gotta catch em all,2,Reddit (r/Sneakers),Nike,RED_14
Nah cuz. Fuck then lows. Id rather my royal 17s than ANY low colorway. But then again I could say the same about all my shoes vs any low. ,2,Reddit (r/Sneakers),Nike,RED_15
these 100% shouldve been a SNKRS US drop but Jordan brand always loves to fuck up 85 releases,9,Reddit (r/Sneakers),Nike,RED_16
"Genuinely my fave release of the year. Very tempted to double up as the think the prices will go up. 

They will look so good worn in, Im wearing mine more than I usually would to have that leather break in.",8,Reddit (r/Sneakers),Nike,RED_17
"Idk man. I hate the way my royals aged. For some reason they seem take more punishment (visually) than any other colorway i have. Also, idk why more ppl dont throw them blue laces on. They really pop with them hoes. ",1,Reddit (r/Sneakers),Nike,RED_18
How did they drop the ball exactly?,5,Reddit (r/Sneakers),Nike,RED_19
Released only in EU,4,Reddit (r/Sneakers),Nike,RED_20
They dropped at a ma maniere and a handful of other boutiques in the US,1,Reddit (r/Sneakers),Nike,RED_21
https://preview.redd.it/nukap7nf0s6f1.png?width=2591&amp;format=png&amp;auto=webp&amp;s=a5866fbf10b2c03b0eb46f85c437c58b2328f341,4,Reddit (r/Sneakers),Nike,RED_22
Nice shoes&I have the 85 metallic navys,2,Reddit (r/Sneakers),Nike,RED_23
"I own these too, the royals blow them outta the water.",2,Reddit (r/Sneakers),Nike,RED_24
Thats not to say the neutral greys arent a fire pair. I love mine.,3,Reddit (r/Sneakers),Nike,RED_25
Not the 2021 pair ..they are incredible,1,Reddit (r/Sneakers),Nike,RED_26
"I have a pair of these, not comfortable at all.  Wore a raw spot on my heel. They are relegated to being worn for places Im going to be sitting a lot, with a short walk, like the movies.",4,Reddit (r/Sneakers),Nike,RED_27
"I have a pair too, they required a more significant break-in period than any of my other sneakers, but after that they fit like any other Jordan 1/dunk/AF1",5,Reddit (r/Sneakers),Nike,RED_28
"The materials and tooling on these are exactly the same as the 85 High Breds. So both these require a longer break in period, but they are very comfy once broken in from my experience&I have the 85 metallic navys as well and I find the materials on the Royals more premium but stiff like the original 1985 shoe",4,Reddit (r/Sneakers),Nike,RED_29
"Interesting, I have a pair of the 85 low neutral greys and those were comfortable. Guessing they cheaped out on these.",4,Reddit (r/Sneakers),Nike,RED_30
Ive walked a long way in mine never had the issue. The leather is stiffer but find it wears to fit really well,2,Reddit (r/Sneakers),Nike,RED_31
"Great colors, they are beautiful",2,Reddit (r/Sneakers),Nike,RED_32
Those are pretty nice,2,Reddit (r/Sneakers),Nike,RED_33
I got these 10 years ago along with the Chicagos and wear them this day.  They are my favorite Jordans for their versatility with shorts and jeans.,2,Reddit (r/Sneakers),Nike,RED_34
"Hey man, as long as these little gen 12s keep the aj low hype train moving, I get my ogs at a decent price. Not to mention, im not wearing the same shoes as all these little kids who've never even seen Jordan dribble a basketball. ",2,Reddit (r/Sneakers),Nike,RED_35
"Wait, drop the ball means they did something wrong. Whats wrong with these? Cuz I heard they are same style as the breds from earlier this year. And everybody seemed to love them",1,Reddit (r/Sneakers),Nike,RED_36
I meant the release of these&these shouldve been a SNKRS drop instead of a limited release to select retailers,1,Reddit (r/Sneakers),Nike,RED_37
There was a sneakers drop of them. They didnt pop off and they pulled them.,1,Reddit (r/Sneakers),Nike,RED_38
I meant the release of these&these shouldve been a SNKRS drop instead of a limited release to select retailers,1,Reddit (r/Sneakers),Nike,RED_39
Why do you think that?,1,Reddit (r/Sneakers),Nike,RED_40
Not sure&.but they shouldve done a wider release of these considering the effort they put into these just like the 85 High Breds,2,Reddit (r/Sneakers),Nike,RED_41
The 85 metallic navys just showed up at my local Nike outlet. I'm hoping these will pop up there one day.,1,Reddit (r/Sneakers),Nike,RED_42
I got the metallic navys for $90 at a Nike outlet,3,Reddit (r/Sneakers),Nike,RED_43
Same price I paid. How do these fit compared to the metallics?,2,Reddit (r/Sneakers),Nike,RED_44
"These have stiffer leather, so need a bit more break in time. The toe box is more pointy, but I didnt notice any discomfort, I went down half a size on both these despite their thick heel padding",2,Reddit (r/Sneakers),Nike,RED_45
they fucked up the sizing as well,1,Reddit (r/Sneakers),Nike,RED_46
They should make all their lows SBs and they would sell.,1,Reddit (r/Sneakers),Nike,RED_47
"https://preview.redd.it/rkd1qkbc6t7f1.jpeg?width=1280&amp;format=pjpg&amp;auto=webp&amp;s=4abfc4416fba65596df4a4cbb53e711b569a06ae

We have same brotha but not color blue nike logo looks clean too",1,Reddit (r/Sneakers),Nike,RED_48
Shape ..quality ..not even close ! 85s smoke those !,1,Reddit (r/Sneakers),Nike,RED_49
Why ? Everyone got em if they wanted em ?,1,Reddit (r/Sneakers),Nike,RED_50
"I dont like that blue but u do u

Coming from a dude who only buys white AF1s",-15,Reddit (r/Sneakers),Nike,RED_51
Weird energy to bring to a sneakers sub haha,22,Reddit (r/Sneakers),Nike,RED_52
Real talk those are butt,-6,Reddit (r/Sneakers),Nike,RED_53
They had this same look back when I was 13 lmao they sure don't change much,-3,Reddit (r/Sneakers),Nike,RED_54
That changed when the 2s came out.,1,Reddit (r/Sneakers),Nike,RED_55
"Congrats! Tried to no avail. Oh well, money saved, unto the next L!",22,Reddit (r/Sneakers),Nike,RED_56
This is the right mentality to have! Ill be enjoying Ls now for the foreseeable future. =,6,Reddit (r/Sneakers),Nike,RED_57
"Another day another SNKRS L. Would have been cool to own - Donkey Kong Country was the first game I ever played. My dad won a SNES plus this game in a cereal sweepstakes back in the day >#

Resale is already pretty high so it's probably a pass for me right now. Congrats to those of y'all that got it!",8,Reddit (r/Sneakers),Nike,RED_58
I remember those cereal sweepstakes so now Im feeling kinda old! =,2,Reddit (r/Sneakers),Nike,RED_59
The Banana soles are dope but I hate the polygon model,3,Reddit (r/Sneakers),Nike,RED_60
"Yeah, Im not really a fan of the regular low polys. I think the overall design was very underwhelming, but the loud materials and extra embellishments on this pair I really like.",3,Reddit (r/Sneakers),Nike,RED_61
"Def the best yet of them. Good for a display box, if I wanted to wear something that loud itd be the planet of the apes nigos.",1,Reddit (r/Sneakers),Nike,RED_62
"I grew up playing all the games (even remember renting DK64 only to have to make my dad drive me back to get the expansion pak from the place =) so I really _wanted_ to like this model but I've never been crazy about DK. Yellow's my favorite color and I spent literal years playing GoldenEye with friends, strangers, and fellow summer camp patrons and I'm so in for those when they release.",5,Reddit (r/Sneakers),Nike,RED_63
"Ahhh, those were the good ol' days. I've got so many N64 GoldenEye memories so I'm def going for those too.",1,Reddit (r/Sneakers),Nike,RED_64
"Just me or does Air Max Day get less hype from Nike these days? Mid 2010s it felt like a much bigger deal, multiple models, engagement etc. Go on NDC US today and there's no mention of it - just the DN8, which is ugly and an fairly inconsequential AI designer thing. Shame overall, I was a fan.",4,Reddit (r/Sneakers),Nike,RED_65
What a waste of energy this release was,7,Reddit (r/Sneakers),Nike,RED_66
Cant believe I got them. First time Ive hit on SNKRS in literally years.,5,Reddit (r/Sneakers),Nike,RED_67
"Same, first hit since early 2023",4,Reddit (r/Sneakers),Nike,RED_68
Congrats on the W! I was pretty shocked I hit too.,1,Reddit (r/Sneakers),Nike,RED_69
Is this going to be the only release for these? I've only recently got into sneakers so this was my first draw attempt and I didn't get picked.,2,Reddit (r/Sneakers),Nike,RED_70
"Unfortunately, I think this is the only online release for these. I think there were a few boutiques that got some pairs to raffle off for in-store events but that's it. This was a super limited release. Welcome to the sneaker game, though! Taking L's is inevitable.",1,Reddit (r/Sneakers),Nike,RED_71
thanks and nice work!>*,2,Reddit (r/Sneakers),Nike,RED_72
SO jealous!,2,Reddit (r/Sneakers),Nike,RED_73
swing and a miss. asked someone else to try for me they picked they size and hit Lmao,1,Reddit (r/Sneakers),Nike,RED_74
"Damnnn, L friend =

Let me guess, they never enter SNKRS draws?",1,Reddit (r/Sneakers),Nike,RED_75
nah they hit pretty often,1,Reddit (r/Sneakers),Nike,RED_76
I was able to hit a 13,1,Reddit (r/Sneakers),Nike,RED_77
What a waste of energy this release was,1,Reddit (r/Sneakers),Nike,RED_78
I miss the old SNKRS app. Ive never hit on the new way&,0,Reddit (r/Sneakers),Nike,RED_79
I feel you. I honestly think its just because there are way more people going for sneaker drops in 2025 vs 2015,3,Reddit (r/Sneakers),Nike,RED_80
Yep I feel like youre exactly right. Its so unfortunate,1,Reddit (r/Sneakers),Nike,RED_81
oh you really killed it,29,Reddit (r/Sneakers),Nike,RED_82
they had those kobes at the outle!!? man i love those i still have my original release pair,23,Reddit (r/Sneakers),Nike,RED_83
"Ive seen them at, at least 2 out here in Cali",3,Reddit (r/Sneakers),Nike,RED_84
Which ones?,2,Reddit (r/Sneakers),Nike,RED_85
the kobe what the pair !,2,Reddit (r/Sneakers),Nike,RED_86
Na I meant what stores,1,Reddit (r/Sneakers),Nike,RED_87
Camarillo I frequent a lot and the block of orange or outlets,2,Reddit (r/Sneakers),Nike,RED_88
Fosho. Block of orange isnt too far from me. Good lookin out.,1,Reddit (r/Sneakers),Nike,RED_89
somebody snag me a pair of,1,Reddit (r/Sneakers),Nike,RED_90
"I cant believe my luck all full box with lid and size 12, except for the Drake Air Force ones for my son",17,Reddit (r/Sneakers),Nike,RED_91
Kobes for 85 buckeroos? Damn,12,Reddit (r/Sneakers),Nike,RED_92
Hence my strong response,1,Reddit (r/Sneakers),Nike,RED_93
Those Kobes are the best shoes Ive ever played in,9,Reddit (r/Sneakers),Nike,RED_94
So curious man they look amazing but I feel like theyd be so confining to play in. What made em so good?,1,Reddit (r/Sneakers),Nike,RED_95
"Weight, grip and most of all ankle support. I wear ankle brace and these shoes made me not have to wear one. I had them pre 2020 and my only regret was playing outdoors with them so i killed then quickly",5,Reddit (r/Sneakers),Nike,RED_96
I have a bad ankle due to past injuries and am only 30 so I may have to check these out,2,Reddit (r/Sneakers),Nike,RED_97
Whats a Tran discount ?,5,Reddit (r/Sneakers),Nike,RED_98
Transaction.,5,Reddit (r/Sneakers),Nike,RED_99
Had same question dude so ty,2,Reddit (r/Sneakers),Nike,RED_100
"If youre not a member,  and become one in any Nike store they will give you 15 percent off.",2,Reddit (r/Sneakers),Nike,RED_101
"DAMN, I need to become trans! Or take a trans friend with me to the store? ",5,Reddit (r/Sneakers),Nike,RED_102
"Damn, I remember a point in time when those Kobes were THE shoe on the market.",2,Reddit (r/Sneakers),Nike,RED_103
"Scooooorrrree!!!! The Nike Outlet rarely Disapoints& Especially, if you wear above a Sz 12 where Im @ in N.Cali.. Enjoy=«",2,Reddit (r/Sneakers),Nike,RED_104
Thanks woman! Lol,2,Reddit (r/Sneakers),Nike,RED_105
Im a Female Friend..=,1,Reddit (r/Sneakers),Nike,RED_106
My bad skimming so many comments,2,Reddit (r/Sneakers),Nike,RED_107
Can we rap about that?!?!?,1,Reddit (r/Sneakers),Nike,RED_108
Sure Fam&:,1,Reddit (r/Sneakers),Nike,RED_109
Those Kobe's =%=%=%,2,Reddit (r/Sneakers),Nike,RED_110
![gif](giphy|l4FB0GjGZF3R8qYIo),2,Reddit (r/Sneakers),Nike,RED_111
Man they gave you a discount for being partially trans? Id be going back with my lawyer,2,Reddit (r/Sneakers),Nike,RED_112
"If thats all I took to get 15% off on every Nike purchase, they can call me whatever they want",3,Reddit (r/Sneakers),Nike,RED_113
"Send some size 12s my way. Local outlet only ever has goofy colored dunks and occasional aj1 mids.

Edit: Johnson creek is my local outlet too haha.",1,Reddit (r/Sneakers),Nike,RED_114
"You should go check them out, bro they had quite a few. Im not sure how many more they might have.",2,Reddit (r/Sneakers),Nike,RED_115
These actually comfy to play in? Those kobes look cool but must be so confining and stiff,1,Reddit (r/Sneakers),Nike,RED_116
"According to some of the other comments, theyre amazing to play and I just bought them today so I wouldnt know yet",2,Reddit (r/Sneakers),Nike,RED_117
Fair point dude lol duh. Well keep us posted on your thoughts,1,Reddit (r/Sneakers),Nike,RED_118
![gif](giphy|Go30VSSpSm0c8|downsized),1,Reddit (r/Sneakers),Nike,RED_119
"Its time that I start working the phone line &amp; reach out to nearby outlets

![gif](giphy|vEJGsXtEE1Sc8|downsized)",1,Reddit (r/Sneakers),Nike,RED_120
Damn thats a nice come up. I should check the outlets. I wear 13 though,1,Reddit (r/Sneakers),Nike,RED_121
85 bucks for Jordan 3s is a no brainer! Nice scores,1,Reddit (r/Sneakers),Nike,RED_122
Winner winner chicken dinner,1,Reddit (r/Sneakers),Nike,RED_123
Bloody hell. I'd just grab those Kobe's and RUN!,1,Reddit (r/Sneakers),Nike,RED_124
"Its funny because the guy at the store was so excited to show them to me and hes like man. I got these Fire Kobes and I was like I dont think I really like Kobes man. Ill probably just take the two pure monies because I know Ill get them dirty so fast and hes like let me just show them to you and as soon as he brought them out, Im like all right Ill take those as well. Lol",2,Reddit (r/Sneakers),Nike,RED_125
"Shit bro, you in my neighborhood.  LOL!  Good haul though, I swing through there from time to time and can usually cop some decent pairs for daily wear.",1,Reddit (r/Sneakers),Nike,RED_126
Holy crap what the kobes at the outlets is insane,1,Reddit (r/Sneakers),Nike,RED_127
My favorite kobes were the huarache 2k4 and these remind me of them so much. I kinda want a pair wonder if any  vegas outlets  have em,1,Reddit (r/Sneakers),Nike,RED_128
You snapped,1,Reddit (r/Sneakers),Nike,RED_129
AJ3 for 100 usd? here it's 200+ in my country =-,1,Reddit (r/Sneakers),Nike,RED_130
What is a Tran percent discount ??,1,Reddit (r/Sneakers),Nike,RED_131
Transaction percentage discount. Walk in the store find a team member have them tell you about opening up a nike.com account scan the barcode and open an account and you get 15% off.,3,Reddit (r/Sneakers),Nike,RED_132
"Thats whats up&Im still kinda hatin tho

![gif](giphy|LCo3JuJ8ca3XXJQqlM)",116,Reddit (r/Sneakers),Nike,RED_133
"Lets be family fam

![gif](giphy|xVPosMMzT60Xzv31my)",57,Reddit (r/Sneakers),Nike,RED_134
![gif](giphy|L69hWWDRdc0NQ66pwZ),18,Reddit (r/Sneakers),Nike,RED_135
Lol people have been finding these at Burlington for $75,42,Reddit (r/Sneakers),Nike,RED_136
They are still super nice. They must have just made too many.,15,Reddit (r/Sneakers),Nike,RED_137
Thats actually the real reason. The stock numbers were high on this release.,2,Reddit (r/Sneakers),Nike,RED_138
On this release a year ago,2,Reddit (r/Sneakers),Nike,RED_139
"Yeah, thats why its in Burlington now on sale lol. Cause they still have inventory a year later",1,Reddit (r/Sneakers),Nike,RED_140
https://preview.redd.it/wgmau1zcu1cf1.jpeg?width=1440&amp;format=pjpg&amp;auto=webp&amp;s=d62fa66e9e8dcd65815c6b9198ab0aac7a25c117,5,Reddit (r/Sneakers),Nike,RED_141
These have been showing up at Burlingtons for $75.,5,Reddit (r/Sneakers),Nike,RED_142
Have you found a pair? Finding them at Burlington for $75 would be nice but its still a great price because most wont.,6,Reddit (r/Sneakers),Nike,RED_143
I did the same thing but regret my purchase. I havent even worn them yet.,10,Reddit (r/Sneakers),Nike,RED_144
 Nice! Just make sure to wear hospital socks with them..,3,Reddit (r/Sneakers),Nike,RED_145
"or...you know, tie your shoes?",4,Reddit (r/Sneakers),Nike,RED_146
Idk why youre being a smartass. All AMM 4s are known to have this issue. Its a common complaint,0,Reddit (r/Sneakers),Nike,RED_147
Yeah...if you dont tie your shoes,3,Reddit (r/Sneakers),Nike,RED_148
"Thousands disagree with you but Im glad youre dont have the slippage, thats great.",0,Reddit (r/Sneakers),Nike,RED_149
Why? Does the foot slip easily in them?,3,Reddit (r/Sneakers),Nike,RED_150
"Most ppl have that issue with them, yea.",1,Reddit (r/Sneakers),Nike,RED_151
"Foot cant slip if the shoe fits dawg, tie em up good to go",3,Reddit (r/Sneakers),Nike,RED_152
For life?? Damn thats glorious,1,Reddit (r/Sneakers),Nike,RED_153
![gif](giphy|XIsdC4jJOpHVYcfGnD|downsized),2,Reddit (r/Sneakers),Nike,RED_154
"I used to work at the San Antonio store a few years ago, i remember getting those ow af1s with the spikes that bricked for like half off and hooking my cousins up with $45 dunks it was incredible lol",2,Reddit (r/Sneakers),Nike,RED_155
I have these but might sell them off. These are so uncomfortable and kill my feet.,2,Reddit (r/Sneakers),Nike,RED_156
big ass feet,2,Reddit (r/Sneakers),Nike,RED_157
I want my family to go to college. Everything going on discount anyway,3,Reddit (r/Sneakers),Nike,RED_158
Does nike ban you from college or what,8,Reddit (r/Sneakers),Nike,RED_159
Why would you even bring that up lmao? Sounds like jealousy.,2,Reddit (r/Sneakers),Nike,RED_160
"Of what? I have the first violets (which are better IMO)

All im saying is everybody is getting FnF rates these days because none of these shoes selling anymore",-2,Reddit (r/Sneakers),Nike,RED_161
lol&..college is overrated. I have college degrees. Notice I said degrees not degree and insurance designations. College is not for everyone and its definitely not the golden road for success.,-5,Reddit (r/Sneakers),Nike,RED_162
I also have multiple degrees and I love my job and life,3,Reddit (r/Sneakers),Nike,RED_163
this is a horrible take.,1,Reddit (r/Sneakers),Nike,RED_164
"my mom works there and ive never gotten to get a ma manieres, is this the employee site?",1,Reddit (r/Sneakers),Nike,RED_165
"https://www.nike.com/t/air-jordan-4-retro-x-a-ma-mani%C3%A9re-womens-shoes-Jx4cpJ/FZ4810-200

Not sure exactly how it works but that's the Nike site",0,Reddit (r/Sneakers),Nike,RED_166
sweet thanks,2,Reddit (r/Sneakers),Nike,RED_167
Its the swoosh site,1,Reddit (r/Sneakers),Nike,RED_168
For regular people itll be the Nike site but for family and Nike employees youll see 40% off,1,Reddit (r/Sneakers),Nike,RED_169
yeah i have the employee discount on my account,2,Reddit (r/Sneakers),Nike,RED_170
"I see, I only have my mom and pops on my swoosh and Nike list",0,Reddit (r/Sneakers),Nike,RED_171
"They say bloods thicker than water

![gif](giphy|DEFyN24tdjLys3PuWU)",1,Reddit (r/Sneakers),Nike,RED_172
https://preview.redd.it/yqoglpetwzbf1.jpeg?width=1079&amp;format=pjpg&amp;auto=webp&amp;s=f1979692a6780fc51adadc08e3106f4905cc32f2,1,Reddit (r/Sneakers),Nike,RED_173
Better discount than what I get rn for working at footlocker damnn,1,Reddit (r/Sneakers),Nike,RED_174
Been wearing the fuck outta my pair this summer. Theyre really versatile.,1,Reddit (r/Sneakers),Nike,RED_175
Killer deal,1,Reddit (r/Sneakers),Nike,RED_176
"I got them last drop, havent worn them yet. Gotta say they are way lighter in person compared to the pics on the Nike app. Beautifully done kicks though.",1,Reddit (r/Sneakers),Nike,RED_177
Amazing price. Beware though. Been wearing these a ton and they still stiff as all hell.,1,Reddit (r/Sneakers),Nike,RED_178
"I love this connection. This makes buying at box price hard for me mustless paying some reseller hundreds over retail AFTER a shoe dropped, that whole idea is hideous to me. The only way Im going over box is if its a sure fire no go most likely and Im buying it before release and have it in hand before release date. Other than that miss me with it.",1,Reddit (r/Sneakers),Nike,RED_179
https://preview.redd.it/0uz8g67y8acf1.jpeg?width=735&amp;format=pjpg&amp;auto=webp&amp;s=de355ed8d83d40d8ea614cf553b43d8a97df7d00,1,Reddit (r/Sneakers),Nike,RED_180
"![gif](giphy|fUvdMx1aevzEVMRy1E)

How it feels fr. My aunt used to work at Ross so any Ross/DDs we went to i believe quarterly the employees receive a 40% discount. My cousin works at Nordstrom same thing but i believe it goes up to 20% most not sure",1,Reddit (r/Sneakers),Nike,RED_181
Yeah Im sure it does&but there is no Ross in my area.,1,Reddit (r/Sneakers),Nike,RED_182
https://preview.redd.it/s4umqsw0u1cf1.jpeg?width=1439&amp;format=pjpg&amp;auto=webp&amp;s=1a05f0bd3f73db7991b8f4b87cfe86f1952966f5,1,Reddit (r/Sneakers),Nike,RED_183
Lucky bastard!!= I need that deal lol,1,Reddit (r/Sneakers),Nike,RED_184
I rly need a connection at Nike&whether thats a friend or family that works at Nike. Need that employee discount,1,Reddit (r/Sneakers),Nike,RED_185
These were sitting on the snkrs app in most sizes yesterday. They can also be found in burlington stores,2,Reddit (r/Sneakers),Nike,RED_186
I alrdy have these but I just mean in general. Would rly like a 40% discount =,1,Reddit (r/Sneakers),Nike,RED_187
& it if they worked at Burlington =,1,Reddit (r/Sneakers),Nike,RED_188
Even on sale these AMM 4s are =®,0,Reddit (r/Sneakers),Nike,RED_189
What an ugly color way.,-1,Reddit (r/Sneakers),Nike,RED_190
"https://preview.redd.it/cv5n7w2o0zdg1.jpeg?width=3024&amp;format=pjpg&amp;auto=webp&amp;s=1d5235b726417d05352713c4184a0b9cc1c3d71f

1984 Air Ship",48,Reddit (r/Sneakers),Nike,RED_191
I love those but the metallic 1s you have in the background =@ how many of the metallic pairs do you have?,8,Reddit (r/Sneakers),Nike,RED_192
Ive got 2 blue and one red. Been REALLY wanting a green forever but $$$$$$$,8,Reddit (r/Sneakers),Nike,RED_193
"Oh yeah i just saw the price for an orange pair on ebay and god damn =.=¨ lol something about that metallic green though probably one of my fave pairs of the set besides the purple or red metallic.",1,Reddit (r/Sneakers),Nike,RED_194
"Ill grab a pair someday. 

I do have those 94 WC3 in DS! Lolololol and a pair to wear too",2,Reddit (r/Sneakers),Nike,RED_195
there is an orange on ebay????,1,Reddit (r/Sneakers),Nike,RED_196
"https://preview.redd.it/jjb6trfv1zdg1.jpeg?width=4032&amp;format=pjpg&amp;auto=webp&amp;s=ec04001d819dd0e30b92547f2b3a3741e5677033

1994 Black Cement 3s. I own the white cements as well and intend to sole swap them eventually too.",22,Reddit (r/Sneakers),Nike,RED_197
Look at that fucking leather. Damn. Imagine quality like that today.,2,Reddit (r/Sneakers),Nike,RED_198
Did you swap the backtabs? I've been looking for someone who makes them i remember someone mentioning a name to me back then but i never followed him and i forgot who it was.,1,Reddit (r/Sneakers),Nike,RED_199
