text,rating,source,brand,doc_id
Take my upvote haha,4,Reddit (r/Sneakers),Nike,RED_1297
wtf youre living my dream,3,Reddit (r/Sneakers),Nike,RED_1298
"It was cool, but I kind of feel bad for them. We werent asked to leave the Ulta immediately, so we were able to stick around once they were done with the fan portion. They shifted to doing a photo op browsing the store and you could tell they were a little overwhelmed (doesnt help that they had to do this while weaving through the fans that stayed). Megan was kind of aimlessly walking around with a basket in her hands, seemed like she was dissociating. 

They seem so regular. Crazy to think people idolize them so heavily.",8,Reddit (r/Sneakers),Nike,RED_1299
They are just humans at the end of the day,3,Reddit (r/Sneakers),Nike,RED_1300
If you literally had the luckiest week of your life I'm happy for you homie =¯,3,Reddit (r/Sneakers),Nike,RED_1301
I'm gonna be real I'd be more excited about meeting Katseye that's an experience of a lifetime. But also congrats on the win too!,3,Reddit (r/Sneakers),Nike,RED_1302
Oh I know. The only other celebrities Ive met before this were Billy Woods and Shawn Michaels lol,3,Reddit (r/Sneakers),Nike,RED_1303
https://preview.redd.it/82qwhhy4gpgf1.jpeg?width=728&amp;format=pjpg&amp;auto=webp&amp;s=9a9de7e8784679dc57eaeef5efcb75544c8be062,4,Reddit (r/Sneakers),Nike,RED_1304
Wow u met Katseye too =% happy for u,8,Reddit (r/Sneakers),Nike,RED_1305
Interesting that there are multiple ethnicities in a kpop group i dig it,2,Reddit (r/Sneakers),Nike,RED_1306
"Bro same. Received the golden letter Rare Airs, hit on Undefeated and camped for 95 SBs. Good week.",2,Reddit (r/Sneakers),Nike,RED_1307
My goats katseye =-,2,Reddit (r/Sneakers),Nike,RED_1308
"Buying KICKS

For a boring dumb bitch

Fucking GNARLY",2,Reddit (r/Sneakers),Nike,RED_1309
Who is girl in the red,1,Reddit (r/Sneakers),Nike,RED_1310
"First girl is beautiful =",1,Reddit (r/Sneakers),Nike,RED_1311
Why are multiple people saying gnarly? Is it back in the vernacular or is it a reference?,1,Reddit (r/Sneakers),Nike,RED_1312
https://youtu.be/R2-yomhYAj4?si=dR-VNkiTFfIvyFft,2,Reddit (r/Sneakers),Nike,RED_1313
"Oh shit, I like that. Thanks",2,Reddit (r/Sneakers),Nike,RED_1314
You should look up one of their live performances. Seriously impressive,2,Reddit (r/Sneakers),Nike,RED_1315
"Will do, I added the song to my library to dig deeper tomorrow",1,Reddit (r/Sneakers),Nike,RED_1316
Its a song,1,Reddit (r/Sneakers),Nike,RED_1317
Thanks! I use the word a lot but Im kinda old so I didnt know if it was coming back around.,1,Reddit (r/Sneakers),Nike,RED_1318
Aw you got the grey tow cap smh,1,Reddit (r/Sneakers),Nike,RED_1319
What is Kathy's but congratulations,1,Reddit (r/Sneakers),Nike,RED_1320
I swear...they need to make 2nd R on RARE very visible,1,Reddit (r/Sneakers),Nike,RED_1321
Nah (° \ °),1,Reddit (r/Sneakers),Nike,RED_1322
Toe Cap Xs woulda over did it,0,Reddit (r/Sneakers),Nike,RED_1323
Crazy how one time all I mentioned the city I lived in and was auto banned for two days for selling and this dickwad literally puts it out and nothing happens to him,1,Reddit (r/Sneakers),Nike,RED_1324
"Oh, so that's all you said? Cause it seems like you said this as well: 


""Any 1s 9.5s/10 you dont want lmk""


Crazy how you're straight up lying about what you said. If you see any rule breaking behavior report it, otherwise you're just crying about getting caught breaking the rules yourself.",1,Reddit (r/Sneakers),Nike,RED_1325
I repent daddy,1,Reddit (r/Sneakers),Nike,RED_1326
"Before anyone says anything about you being new into sneakers or ANYTHING. Let me explain 

People loved pandas when they were hard to get 
They became not so hard to get so everyone started hating on them because their insecure ass wanted to feel important by having limited sneakers 

Ive been collecting for 13 years now and i love pandas.",218,Reddit (r/Nike),Nike,RED_1327
"Theyre an actual classic that goes with everything.  Idc that I overpaid for mine. Theyre just a calm shoe with a timeless style that works with everything

I can pull out my pandas 5 years from now and theyll look fine with whatever the current fashion trends are. There arent alot of shoes in my collection i can say that about with 100% confidence.",36,Reddit (r/Nike),Nike,RED_1328
"100%

These made me buy more black n white colourblocked sneakers. E.g. The Jordan 1 high and the TS Af1's. They all go with everything just depends on your mood",13,Reddit (r/Nike),Nike,RED_1329
How much did you pay?,1,Reddit (r/Nike),Nike,RED_1330
"175. Nothing crazy. They were still tough to grab back then tho.

I have the pink and black croc dunks I grabbed for like 65 recently too. They have the same vibe as pandas. I wear them quite a bit now too.",5,Reddit (r/Nike),Nike,RED_1331
![gif](giphy|x6sfBlcbXW7kc),6,Reddit (r/Nike),Nike,RED_1332
Makes sense.,14,Reddit (r/Nike),Nike,RED_1333
"I agree with this, my wife and kids all have a pair of Pandas and I actually have two pair. I careless what people think about Pandas lol.",5,Reddit (r/Nike),Nike,RED_1334
"To be sincere, I never liked them. I dont like how cheap they look. I owned/skated a lot of the earlier 2000s dunks. These look like the leather they use to make Velcro Walmart grandpa shoes. To me, they look like a 30/40$ shoe. Its the quality that hurt my eyes and soul.",9,Reddit (r/Nike),Nike,RED_1335
Yup me too. Nothing special about these,2,Reddit (r/Nike),Nike,RED_1336
"Yea I hit on the first sneakers release and felt meh about the quality and had gotten the pigeon panda sbs shortly before when they dropped so I flipped em then they restocked 100 times. People hate because everyone got them and they became a thing. And then everyone else got them too. Theyre dunks. Nothing wrong with em, never will be anything wrong with them. Some people want to stand out with something less seen some people want what everyone else has to fit in. Both ok. Theyre classic dunks regardless of the color. Enjoy em",1,Reddit (r/Nike),Nike,RED_1337
This. Dunks are fly tho. So many colorways,2,Reddit (r/Nike),Nike,RED_1338
It makes me happy when people dont try to rewrite history. This is *exactly* how it went down! I dont know why people try to front like it was any different.,2,Reddit (r/Nike),Nike,RED_1339
"They were released in 2021 during the lockdown-sneaker craze. Had they been released before or after, i.e. had they not been so hard to get because of an anomaly, no one wouldve cared about these. Theyve always been terrible quality and have always gotten a lot of hate from long-time customers/fans.",2,Reddit (r/Nike),Nike,RED_1340
"Most sneakerheads dont actually care about quality of the product. They only care if its limited or not. And somehow, limited products are magically high quality and anything that isnt, is not. Dunks have never been high quality. Didnt stop people from calling them sneaker of the year when they were reselling for $300-$400.",4,Reddit (r/Nike),Nike,RED_1341
"Most sneakerheads, post pandemic, yeah I agree. People whove been into sneakers for over a decade just scoffed during those times. They simply were only called soty then because of the sales. Those sales were an anomaly, like I said lol&",2,Reddit (r/Nike),Nike,RED_1342
This is facts,1,Reddit (r/Nike),Nike,RED_1343
"Actually incorrect, they were over hyped for the time period of the Nike Dunk craze era ,if they were released in 2019 or 2023 they wouldnt have been popular .

Had they been available and priced at retail no one wouldve hated them and many would have them as beaters just like now.",-8,Reddit (r/Nike),Nike,RED_1344
You're right despite the down votes. They were way overhyped especially for a generic dunk that has cheap materials and is not comfortable to wear all day.,2,Reddit (r/Nike),Nike,RED_1345
"Absolutely correct. Sneakerheads generally couldnt have cared less about any SB drop for like a decade, they made a big resurgence around 2020 and now everyone and their mother has some panda dunks. Thats just the reality of things lol",2,Reddit (r/Nike),Nike,RED_1346
Hit the nail on the head right here. The downvotes just goes to show you how many casuals infest these subs =,0,Reddit (r/Nike),Nike,RED_1347
exactly this I sold my pair when they first released for $350 people don't hate em they just mad af that they overpaid lol,0,Reddit (r/Nike),Nike,RED_1348
"The golden rule to follow is - buy/wear what YOU like, not what others like. Its much more fun that way.",38,Reddit (r/Nike),Nike,RED_1349
"Thats why I got these, absolutely love them",13,Reddit (r/Nike),Nike,RED_1350
"Ive never liked them because of the quality. Had they released an SB version with better materials, Id have copped instantly. I love black &amp; white shoes. Wish theyd rerelease the real pandas",3,Reddit (r/Nike),Nike,RED_1351
"They did. Quite few actually. The Pigeon Pandas, the Huf SF Dunks. Just to name a few",1,Reddit (r/Nike),Nike,RED_1352
"I bought some today, love them too =<",1,Reddit (r/Nike),Nike,RED_1353
"I wholeheartedly agree with you. Too many people out there chasing hype or likes, when that stuff means nothing. It just sucks that some of the shoes I want are highly coveted and people use bots to grab as many as they can to try and turn a profit on the secondary market. I refuse to pay above retail for shoes now, and love when I see resale prices drop below market",1,Reddit (r/Nike),Nike,RED_1354
That's why I'm currently chilling in my livingroom wearing velvet Janoskis as slippers.,1,Reddit (r/Nike),Nike,RED_1355
"Buy what you like and dont listen to others. Do you. Btw, pandas are great and versatile",31,Reddit (r/Nike),Nike,RED_1356
We need more people like you in the community. Its the snobs that made me take 10 steps back.,3,Reddit (r/Nike),Nike,RED_1357
Yessir =L<û,2,Reddit (r/Nike),Nike,RED_1358
"They are my most versatile pair. Rarely do I have anything but colored laces in them, and every color goes.

They are my beaters. When I wear them out, Im probably going to replace them with another pair.",4,Reddit (r/Nike),Nike,RED_1359
Love the fact theyre so easy to style with,1,Reddit (r/Nike),Nike,RED_1360
Classic black and white dunk. I rock em as my daily drivers.,1,Reddit (r/Nike),Nike,RED_1361
"Because during the pandemic, Panda Dunks became one of the most desirable sneakers, and due to the high demand and low supply, resellers were able to sell them for as much as triple the price of retail.

But as time went on people started to realize that the resale price didn't match the mediocre quality of materials and craftsmanship of the Panda Dunk; and while Nike was soon able to produce more pairs to finally meet the demand, resellers were stuck with unwanted pairs as the trend moved on to the next ""hot thing"" (Adidas Sambas). 

Mainly it's just the resellers and hypebeasts are the ones showing hate to the Panda Dunks.

 ",22,Reddit (r/Nike),Nike,RED_1362
I loved Sambas when I was younger. It's sad to see a shoe that was $60-75 a pair go for 120-150 now because they are the hyped thing. Think 2-3 years ago when were still $80. Looked the other day and I was just sad.,3,Reddit (r/Nike),Nike,RED_1363
"Facts. Sadly I miss the days of the kangaroo leather sambas. 

I remember on Confirmed back in 2020 a pair of Adidas Pharrell x Samba were being sold for $65. I wore mine because thats what I do and now I see them being sold for $300+ even used.",1,Reddit (r/Nike),Nike,RED_1364
"I got a pair today for $90 at footlocker, you just gotta go to sales which is almost guaranteed to be either there or the Nike store everyday",1,Reddit (r/Nike),Nike,RED_1365
"I got my Samba OGs for 36 bucks in 2020, they still look good! I wouldn't pay 100 bucks for them, though.",1,Reddit (r/Nike),Nike,RED_1366
Very interesting,1,Reddit (r/Nike),Nike,RED_1367
"Like the others have been saying, just buy and wear what you like, not what others say you should like.",4,Reddit (r/Nike),Nike,RED_1368
How much did they used to cost?,1,Reddit (r/Nike),Nike,RED_1369
"Only reason people hate is because of how popular they became. In a way they killed the dunk because they got so popular. That isnt a bad thing imo. They got popular for a reason - theyre a classic shoe. They look great with anything you can grab from your closet. Its the perfect dumb reach shoe that requires zero effort or thought. 

To some people they became uncool once 40 year old moms started wearing them. Personally I think thats dumb. Wear whatever you like. If I see an old lady rocking some P6000s or an old guy wearing some NB 991V2s that wont change how I view the shoe at all. 

Theres always a place for a dumb reach shoe in my collection. I hope you enjoy them,  Im positive you will.",7,Reddit (r/Nike),Nike,RED_1370
Great points right there=L<û,1,Reddit (r/Nike),Nike,RED_1371
I bet you look great in them momma,2,Reddit (r/Nike),Nike,RED_1372
"When I was a kid, I thought it was cool running into someone wearing the same thing. 'oh!!! we have same shoes/shirts!'

Now I'm grown up, it feels very different. It's exactly the opposite.",8,Reddit (r/Nike),Nike,RED_1373
Its not the same in India and not many people buy expensive sneakers.,3,Reddit (r/Nike),Nike,RED_1374
"There was once a time at peak hype, the material, construction and the comfort of the shoe did not justify the resale price at all. So in my personal experience, it wasn't so much as a hate for the shoe, it was a hate for the fomo panda-monium it caused, the fact that i wasn't trying to let people shell out 300 dollars for a shoe that shouldn't be sold for over 90. It was one shoe that was never worth the upcharge.",3,Reddit (r/Nike),Nike,RED_1375
"People loved the pandas because they couldn't get what they wanted (aka the pigeon dunks ""pandas""), so this was a GR that was closest people could get. Don't get me wrong, its a simple color way that you can wear with ANYTHING but this shoe got SAVERELY over hyped (imo), I just think people hated it so much BECAUSE they got so popular and not as ""rare"" as people expected and they knew it was just a GR shoe. 

  
\- TBD I dont mind the pandas, simple color ways are literally the best dunks.",3,Reddit (r/Nike),Nike,RED_1376
Makes sense,1,Reddit (r/Nike),Nike,RED_1377
"Me and my daughter tried on a pair in a store. They arent a good shoe. The leather is not good leather and seems almost vinyl like. To us, on top of that the fit seemed off. If you like them. then thats all that matters.",3,Reddit (r/Nike),Nike,RED_1378
Theyre stiff at first but after you wear them for a day they feel a lot more comfortable,1,Reddit (r/Nike),Nike,RED_1379
"People like you who are grateful for owning a pair of pandas is what the sneaker community should be all about. This hypebeast culture is toxic AF and shouldnt influence what we wear. I love mine  so much I bought an extra pair, it goes with almost anything you wear. I wear them more than any Js I own. All this to say if you like them thats all that matters, enjoy!",3,Reddit (r/Nike),Nike,RED_1380
Thank you =L<û,1,Reddit (r/Nike),Nike,RED_1381
"People were paying $400 a pair, then Nike restocked them and people werent happy. All the sudden that $400 shoe was sitting on shelves for $80.. I would have been pissed too. But I also wouldnt pay $400 for a Nike Dunk either..",3,Reddit (r/Nike),Nike,RED_1382
Basically hate originated in the sellers community rather than sneaker community,1,Reddit (r/Nike),Nike,RED_1383
"Yes and no. People who sell shoes probably started out as sneaker heads, but the money twists that love and makes it something else. If you paid $400 for a shoe and seen it on the shelf a couple months later for $80, how would you feel? Cant lie, Id be salty about it.",2,Reddit (r/Nike),Nike,RED_1384
Yea that makes sense,1,Reddit (r/Nike),Nike,RED_1385
Classic shoes at this point that go with almost everything.  The hate is corny.,3,Reddit (r/Nike),Nike,RED_1386
"Wanted a pair... Couldn't find a pair... Got a pair... The black from the laceway or whatever it's called rubbed off on the toebox within days and couldn't be cleaned. The shoe looked and felt cheap. Was not first wave, but was legit ordered from the Nike site... won't order GR dunks that aren't suede again.",5,Reddit (r/Nike),Nike,RED_1387
"Yeah, regular dunks don't have the quality that you'll find with SBs. The ""leather"" is so very cheap and coated in plastic. The insole might as well be cardboard. They weren't always this way but over the decades they've made them worse and worse to the point now where they're trash. Look nice on your screen but not so good on your feet.",5,Reddit (r/Nike),Nike,RED_1388
People don't like them because they used to be hard to find when they came out then when they were more readily available they became a bit rinsed,2,Reddit (r/Nike),Nike,RED_1389
I think if a sneaker is owners by every other person- that means its not the most hated but most beloved.,1,Reddit (r/Nike),Nike,RED_1390
I think they look kinda cool man. I had one of those and there fire =%.,2,Reddit (r/Nike),Nike,RED_1391
"Normally Im pretty careful when wearing my sneakers (mostly Jordans) and try to keep them as pristine as possible.  However, I have a pair of pandas that Ive allowed to get dirty/creased etc. and I think they get better with age.  I might wear them more than anything else.  So enjoy them and dont allow others to tell you which shoes you should like.",2,Reddit (r/Nike),Nike,RED_1392
Thanks for this comment bro,1,Reddit (r/Nike),Nike,RED_1393
"I dont like regular dunks obviously the black and white ( pandas ) falls into this category , the leather feels plastic af.. plus once you take a step it creases horrendously, although I recently found a refurbished pair of the new pandas with better materials suede and leather for $40 bucks and I said why not theyre miles away from regular pandas imo .",2,Reddit (r/Nike),Nike,RED_1394
over produced... the first run was limited or at least they say it was and thats what drew ppl to them. enjoy your shoes,2,Reddit (r/Nike),Nike,RED_1395
The hate comes from all the people that paid $500+ for these a couple years back. I like the pandas I have bought 2 pairs for family members. I think its a great shoe for someone looking to get into the shoe game. Id pick up a pair for myself but already have the black and white Jordan 1.,2,Reddit (r/Nike),Nike,RED_1396
Makes more sense,1,Reddit (r/Nike),Nike,RED_1397
I think they're only hating on it because it's way too generic/common as almost majority have them and some sneaker heads ego wanted something luxurious or limited supply as they can't resell it to a higher price since its too common.,2,Reddit (r/Nike),Nike,RED_1398
I think common shows = more beloved,1,Reddit (r/Nike),Nike,RED_1399
Nothing wrong with them tbh. Im a big sneaker collector and wear my pandas  to work daily since its office friendly. Collectors are still pissed that they bought resell when it was at its peak of $400,2,Reddit (r/Nike),Nike,RED_1400
Glad you enjoy them,1,Reddit (r/Nike),Nike,RED_1401
"The haters loved them when they had to buy them from a reseller for 200+, but hate them now that they are readily available, shits weird",2,Reddit (r/Nike),Nike,RED_1402
I think the hate comes from the fact they were restocked multiple times for about two years. Had they just had one release and a couple of restocks like most the hate would not be there. I hit on the original drop date and they were reselling for $350. I think there is nothing wrong with them.,2,Reddit (r/Nike),Nike,RED_1403
Thats just unfortunate for sellers but hating is too far,2,Reddit (r/Nike),Nike,RED_1404
"For me it is the absolute shitty quality of the GR Panda Dunks. You glance at the toebox once and it's already creased in the worse kinda way. 

I made a pair on Nike ID and the quality on those are night and day.",2,Reddit (r/Nike),Nike,RED_1405
The next nature panda dunks are better than the regular panda.,2,Reddit (r/Nike),Nike,RED_1406
"Because they are sheep. The panda, now that its readily available, is a great staple shoe. Definitely not worth paying resale for, but its a classic design and colorway that goes with anything. Hypebeasts are upset that everyone like dunks.",2,Reddit (r/Nike),Nike,RED_1407
"Honestly I feel like its a great pick for starting my sneaker collection, got to learn a lot about the community",1,Reddit (r/Nike),Nike,RED_1408
"When i watched a mom pick up her son and daughter from daycare and the three of them PLUS the daycare worker were wearing pandas I decided they werent for me. 

However I think that since they are so common it must mean its a subjectively good shoe. Good shoe, not for me.",2,Reddit (r/Nike),Nike,RED_1409
"Thats at least logical, some people just riding the hate train",1,Reddit (r/Nike),Nike,RED_1410
There was an absurd amount of hype for them years ago and have been saturated since. They're a nice everyday shoe.,2,Reddit (r/Nike),Nike,RED_1411
Red pandas &gt;,2,Reddit (r/Nike),Nike,RED_1412
I just got a pair last week tooo!,2,Reddit (r/Nike),Nike,RED_1413
=L<û congrats dawg,2,Reddit (r/Nike),Nike,RED_1414
Definitely =¯,1,Reddit (r/Nike),Nike,RED_1415
"Personally Im just bored of seeing them. Not that I hate the shoe per se , but definitely an oversaturated market for them. But if you like them enjoy them",2,Reddit (r/Nike),Nike,RED_1416
I never liked the cuz of their quality but would love an sb for sure,2,Reddit (r/Nike),Nike,RED_1417
Me personally every time I see someone wearing them the person is super corny and thats not the group I want to be affiliated with,2,Reddit (r/Nike),Nike,RED_1418
Thanks dawg,1,Reddit (r/Nike),Nike,RED_1419
"I dont think people hate pandas, theyre just the white air forces of the dunk world.",2,Reddit (r/Nike),Nike,RED_1420
People hate them bc resellers can't make any money off them anymore.,2,Reddit (r/Nike),Nike,RED_1421
Shitty reason tbh,2,Reddit (r/Nike),Nike,RED_1422
"That's reseller logic for you, I love my pandas I got them in 2023 and still rock them bc I like them.",1,Reddit (r/Nike),Nike,RED_1423
"I don't ""hate"" em but I don't like em either. All the things people say about them though ""it's a classic shoe/colorway, goes with anything, it's comfortable"" (I completely disagree on the comfort) can be found in other shoes. Seeing everybody and their granny wearing the same thing will turn a lot of people off.",2,Reddit (r/Nike),Nike,RED_1424
"Because most people parrot what others say on the internet. They were one of the hottest shoes when they first dropped then some YouTuber, rapper or  influencer called them bricks or wack and the newbies in the sneaker community followed along.",2,Reddit (r/Nike),Nike,RED_1425
Herd mentality fr,2,Reddit (r/Nike),Nike,RED_1426
"Pretty basic release that sold upwards of $400 a pair at one point&

Market crashed, pairs are snagged new at as low as $70 on some resell apps or outlets..",2,Reddit (r/Nike),Nike,RED_1427
Sellers are still salty I guess,1,Reddit (r/Nike),Nike,RED_1428
I had a pair of pandas that I got back in December and never wore them = I just sold them for what I got them for a month ago.,2,Reddit (r/Nike),Nike,RED_1429
Why sell them if theres no profit just keep them if you like them,1,Reddit (r/Nike),Nike,RED_1430
I dont want to wear a shoe that I see literally everywhere. Most my shoes if not all Ill rarely see another person wearing them.,1,Reddit (r/Nike),Nike,RED_1431
"I got my panda dunks off Uber Eats (JD Sports) , no cap.",2,Reddit (r/Nike),Nike,RED_1432
"At the end of the day, always get what you like. Whether you like its looks, or comfort, laces, whatever it may be. I personally dont care for pandas all that much, let alone dunks, with exceptions. But absolutely always get what you like at the end of the day",2,Reddit (r/Nike),Nike,RED_1433
"Honestly its just people wanting to be the only one with the sold out and popular shoes. They buy multiple pairs and flip them. Pandas were selling for hundreds on the resale market before they became to widely available.
when the average person is able to get a shoe it becomes worthless for a flipper to buy because theres no profit to be had. Pandas were a huge money maker but now anyone can get them so they sell for retail.",2,Reddit (r/Nike),Nike,RED_1434
Salty people are the worst,1,Reddit (r/Nike),Nike,RED_1435
Im just not into shoes that are extremely basic. I always want something a little different. Same reason I wouldnt get adidas superstars or other classic black and white sneaks,2,Reddit (r/Nike),Nike,RED_1436
Thats not hate thats just what you like and not. I get it.,1,Reddit (r/Nike),Nike,RED_1437
"Cos sneakerheads are salty that they paid too much when these were super hype. Now that they've been restocked till no tomorrow, everyone and their mothers have em, they find it too common and hate on it.",2,Reddit (r/Nike),Nike,RED_1438
Makes sense,1,Reddit (r/Nike),Nike,RED_1439
"https://preview.redd.it/ifiro5n8dzaf1.png?width=3024&amp;format=png&amp;auto=webp&amp;s=8f800b6a4ded58cbadf0e753492c8d5c092b8c3a

People hate on Pandas because there are so many dope Dunks, and for a while, we saw EVERYONE wearing a pair of them. We dont HATE them, but just hated the fact that they were everywhere we looked.",2,Reddit (r/Nike),Nike,RED_1440
That only means its the most beloved,1,Reddit (r/Nike),Nike,RED_1441
...its a good entry shoe,2,Reddit (r/Nike),Nike,RED_1442
Yea I think so too,1,Reddit (r/Nike),Nike,RED_1443
"Pandas IMO are still the best dunks out there. You can wear them with anything. I have 6 or 7 other pairs of dunks in various colorways and I almost always reach for my pandas. 

One thing youll find in the sneaker world is that most everyone is just a hype man or fan boy of the newest or rarest shoe. Wear what you like and what looks good on you, dont worry about any of the other nonsense.",2,Reddit (r/Nike),Nike,RED_1444
