text,rating,source,brand,doc_id
"Very interesting, thanks!\
I'm surprised to hear Salomon did not do well in such a test. I personally consider Salomon shoes (Speedcross for example) as some of the best shoes I've used in recent years. But that's just my subjective impression.",1,Reddit (r/RunningShoeGeeks),Nike,RED_2984
A trail type sole probably wont perform that great in this test purely due to the reduced surface area in contact with the ground.,10,Reddit (r/RunningShoeGeeks),Nike,RED_2985
"Yeah, I've experienced that first hand so to speak when running with Speedcross 2 and 6.",1,Reddit (r/RunningShoeGeeks),Nike,RED_2986
"We measured the Speedcross 6 to have 5.8 mm lugs, which is massive. In fact, it's the highest recorded value across 137 trail shoes tested. This gives it excellent soft ground grip at the trade-off of less stability on harder packed surfaces",3,Reddit (r/RunningShoeGeeks),Nike,RED_2987
"Indeed. The grip in soft terrain like (wet) meadow, forrest, etc. Not so amazing on concrete or tarmac, especially when wet.",1,Reddit (r/RunningShoeGeeks),Nike,RED_2988
Yes this is traction (friction) vs. Grip (shape),2,Reddit (r/RunningShoeGeeks),Nike,RED_2989
"223 shoes and top 10 is not from adidas 

I am a bit skeptic about the testing setup. 

how can this [https://i.redd.it/asics-metaspeed-sky-paris-very-impressed-v0-5xbsnpqo7bpc1.jpg?width=2908&amp;format=pjpg&amp;auto=webp&amp;s=27823747791ceb0949a60ad8e7d058c8df8e9715](https://i.redd.it/asics-metaspeed-sky-paris-very-impressed-v0-5xbsnpqo7bpc1.jpg?width=2908&amp;format=pjpg&amp;auto=webp&amp;s=27823747791ceb0949a60ad8e7d058c8df8e9715) metaspeed sky paris 

can be better than [https://assets.adidas.com/images/w\_600,f\_auto,q\_auto/1ea476bc3b97401788c77ec2b52121f1\_9366/Adizero\_Boston\_12\_Shoes\_White\_HP9705.jpg](https://assets.adidas.com/images/w_600,f_auto,q_auto/1ea476bc3b97401788c77ec2b52121f1_9366/Adizero_Boston_12_Shoes_White_HP9705.jpg) boston 12 

I do wear some noosa tris once in a while, but never on wet conditions due to how they have no traction at all. I spent all winter on boston 12 specifically for this purpose 

maybe they are better on dry rather than on wet. a bit surprised from the results, that's all",16,Reddit (r/RunningShoeGeeks),Nike,RED_2990
This is a crazy investment for Im not sure what gain. Purchasing 223 shoes plus this device must have cost a fortune. How do you profit or gain from creating this data?,2,Reddit (r/RunningShoeGeeks),Nike,RED_2991
Its Runrepeat. They likely already had the shoes from their existing reviews and ~~are presumably going to include it in their reviews in future~~ have already added it to their review pages. More data points is always good.,4,Reddit (r/RunningShoeGeeks),Nike,RED_2992
Approximately what would the ambient temperature be during the  traction test?,2,Reddit (r/RunningShoeGeeks),Nike,RED_2993
I have altra experience flow and the grip is pretty good. I also have Nike Pegasus 41 and have had no issues with the grip,2,Reddit (r/RunningShoeGeeks),Nike,RED_2994
Pegasus being basically the worst seems crazy.,2,Reddit (r/RunningShoeGeeks),Nike,RED_2995
"For Pegasus, I can share that poor traction on wet concrete aligns well with our own experience, where we rate it 3/10 on average.",2,Reddit (r/RunningShoeGeeks),Nike,RED_2996
"I need to be a little skeptical about the test, I have nimbus 26 and while the grip is excelent it's not better than the boston 12 or MagMax",4,Reddit (r/RunningShoeGeeks),Nike,RED_2997
"I love the grip in both the Nimbus 26/27 and the Boston 12, agree. Mechanical testing does not always share all of the nuances that you and I as a user can feel/experience. Wear testing is the most important component. 

Thank you for taking the time to share.

A few comments from this sub reddit

&gt;My Nimbus 26 has the Hybrid Asicsgrip &amp; Aharplus outsole rubber. This winter I've worn them on trails, in the snow, on wet pavement &amp; they're great.



&gt;ASICSgrip is really good. I have the magic speed 3 and have done some very hard efforts in heavy rain and never had any issues with grip.



&gt;YMMV, but I've seen people prefer ASICSgrip over Vibram Megagrip, both for traction and durability.



&gt;Also, Asicsgrip is underrated. Ran an intervals workout in the pouring rain and was gripped to the road the entire time, no issues.",1,Reddit (r/RunningShoeGeeks),Nike,RED_2998
"Amazing work. I have to say, it basically aligns with my experience: new ASICS and Puma and Adidas Continental brilliant, Nike and New Balance lacking.",4,Reddit (r/RunningShoeGeeks),Nike,RED_2999
I'm glad to hear this. Thank you for sharing,4,Reddit (r/RunningShoeGeeks),Nike,RED_3000
"I'll take this moment to say, as someone with oddly shaped and wide feet, that the volume and width data you've added with the mouldings is *incredible*.",2,Reddit (r/RunningShoeGeeks),Nike,RED_3001
"Thank you so much! It took one person 6 months to develop and tweak. We also looked into 3d scanners and many other methods, but ultimately found this one to align a lot better with our own and other testers experiences. Thank you again, I appreciate you taking the time to write.",4,Reddit (r/RunningShoeGeeks),Nike,RED_3002
"For my running style, I would NEVER use the Nimbus 26 in the wet. It's terrible on asphalt and paving. Not Nova last 3 levels of terrible, but neither shoe is a chance in the wet.",3,Reddit (r/RunningShoeGeeks),Nike,RED_3003
This testing is horrible. After running a few miles in most asics you might as well up your insurance policy knowing youre gonna slip and fall if its rained in the last month or so.,4,Reddit (r/RunningShoeGeeks),Nike,RED_3004
"Do you have any specific shoes in mind? There's quite a big difference between a Nimbus 27 and a ASICS GT 2000 12 scoring just 0.32. Generally, it's my impression that Asics has nailed it with the ASICSGRIP",4,Reddit (r/RunningShoeGeeks),Nike,RED_3005
"Agreed. The progress that Asics has made in the latest gen outsole is night and day. Used to be unrunnable for me in the wet, now theyre fine.",4,Reddit (r/RunningShoeGeeks),Nike,RED_3006
This post seems oddly pro ASICS lol.,2,Reddit (r/RunningShoeGeeks),Nike,RED_3007
"OP here: Suspiciously so, agree. However, we have no affiliation with ASICS. I should send it to them and ask them to make a voluntary donation to our work :)",9,Reddit (r/RunningShoeGeeks),Nike,RED_3008
Oh I totally didnt realize you were the founder of run repeat.  Ok this makes more sense now.  Love your guys reviews!  Keep up the great work.  =O<ü=L<ü>ö<ü,3,Reddit (r/RunningShoeGeeks),Nike,RED_3009
Thank you so much!,1,Reddit (r/RunningShoeGeeks),Nike,RED_3010
Also would be worth fixing the webpage as it keeps on crashing when scrolling through till end.,1,Reddit (r/RunningShoeGeeks),Nike,RED_3011
"I'll look into it. On mobile or desktop? What browser? If phone, what phone?",1,Reddit (r/RunningShoeGeeks),Nike,RED_3012
"iPhone, iPad safari, edge chrome. Latest software on all. Everytime you scroll through to end of the review it does occur problem.

https://preview.redd.it/trc6701d028f1.jpeg?width=1557&amp;format=pjpg&amp;auto=webp&amp;s=2b3df598c1e208d48faa24ddbebb87407a5e8f52",1,Reddit (r/RunningShoeGeeks),Nike,RED_3013
"https://preview.redd.it/1z9at5lg028f1.jpeg?width=1640&amp;format=pjpg&amp;auto=webp&amp;s=0a31edd3a446e133960d066496d94253ae6d3582

Can replicate on demand pretty much every single time.",1,Reddit (r/RunningShoeGeeks),Nike,RED_3014
"At the exact end, or also if you're half way through or something?",2,Reddit (r/RunningShoeGeeks),Nike,RED_3015
I think it has to do with the massive amounts of media. I'll investigate.,2,Reddit (r/RunningShoeGeeks),Nike,RED_3016
Too much traction is a thing too. I used a pair of ASICS Novablast 3 TR for road running for about two weeks and they nearly destroyed my ankles. When I push off with my toes at the last part of my stride I rotate my feet a bit (most people naturally do this to a degree) but the grippy rubber prevented this so I could barely walk for a month after this. It my favourite shoe for snowy runs but I don't even think about running with them when dry.,2,Reddit (r/RunningShoeGeeks),Nike,RED_3017
Ye it's the same with vibram trail shoes. On road they stick too well and the transition not smooth. Heel normally needs to decouple from forefoot movement.,5,Reddit (r/RunningShoeGeeks),Nike,RED_3018
Try a pair of the 1st gen (OG) Nike Zegama on wet pavement. Ice skates.,1,Reddit (r/RunningShoeGeeks),Nike,RED_3019
"A trail shoe, with its lug sole, doesn't have much rubber to make contact with the floor. If the rubber is designed to provide grip on gym floors in dry conditions, you'll have problems when it gets wet.  
Version 2 offers much better wet traction.",1,Reddit (r/RunningShoeGeeks),Nike,RED_3020
Classic Nike.,1,Reddit (r/RunningShoeGeeks),Nike,RED_3021
"1 brand dominating makes perfect sense. If there was a best ""grip"", it would be down to a unique rubber.

Class!",1,Reddit (r/RunningShoeGeeks),Nike,RED_3022
The test shows that using a specific composition on different shoes with different treads consistently proves to be the best.,1,Reddit (r/RunningShoeGeeks),Nike,RED_3023
Do they do this type of testing for comfort ? I have high arches and need ro find a running shoe that helps make it feel less painful,1,Reddit (r/RunningShoeGeeks),Nike,RED_3024
How worn were they? I have had shoes that slipped on damp concrete and asphalt when new but stopped doing that after 50 miles or so.,1,Reddit (r/RunningShoeGeeks),Nike,RED_3025
"YES, that's right.  
I've noticed this too, especially with Nike shoes: no wet traction until those tiny, pointed rubber protrusions were worn off. Then the traction was a completely different matter, in a positive way.",1,Reddit (r/RunningShoeGeeks),Nike,RED_3026
where is the ranking for adidas adios?,1,Reddit (r/RunningShoeGeeks),Nike,RED_3027
"Adios Pro 4 has a dynamic coefficient of friction of 0.55 compared to the average of 0.46

https://preview.redd.it/jbvmvu2qj98f1.png?width=370&amp;format=png&amp;auto=webp&amp;s=5e45c2c151be013569cc0abdf3c4eb262a86675b",1,Reddit (r/RunningShoeGeeks),Nike,RED_3028
"oh sorry, the one I have is the adizero adios 9. How does it fair against the average friction range?",1,Reddit (r/RunningShoeGeeks),Nike,RED_3029
0.55 (same outsole as the Adios Pro 4),1,Reddit (r/RunningShoeGeeks),Nike,RED_3030
"It's great that this has been added; it's appreciated. It won't be perfect for everyone, but it does provide a clear overview. Runrepeat: Keep up the good work.",1,Reddit (r/RunningShoeGeeks),Nike,RED_3031
The test seems accurate to what I've seen with the shoes I have (Mizuno Wave Sky 8 and Brooks Glycerin 20).,1,Reddit (r/RunningShoeGeeks),Nike,RED_3032
Asics Shoes good Grip? ==Never,1,Reddit (r/RunningShoeGeeks),Nike,RED_3033
Have you tried some of their new models with ASICSGRIP? It's incomparable to their previous outsole compound.,2,Reddit (r/RunningShoeGeeks),Nike,RED_3034
Novablast 3 has one of the badest grip ever (wet),3,Reddit (r/RunningShoeGeeks),Nike,RED_3035
"And it rated badly...!

https://runrepeat.com/asics-novablast-3

Test results
Novablast 3: 0.39
Average: 0.46

New ASICS have a different grip compound...",1,Reddit (r/RunningShoeGeeks),Nike,RED_3036
"I have to admit in the past, none of them had any traction in wet conditions.

But the latest models of running shoes have fantastic grip for me. I even find the rubber compound under the soles better than Continental rubber.",1,Reddit (r/RunningShoeGeeks),Nike,RED_3037
"Very cool project, and very interesting that Asics do so well. Why do you think that is? Outer sole material, if they have a slick sole or not, or overall shape of the bortom of the shoe? 


I think a lot of people here conflates traction with ""feels like I could slip or not"". Traction is just one part of that equation, speed and stability are others.",1,Reddit (r/RunningShoeGeeks),Nike,RED_3038
"The test was conducted on concrete in wet conditions.

The sole's tread won't be of much use there, as it can't penetrate the surface. I would think the more surface area of rubber, the better.

This will mainly depend on the composition of the sole's rubber material.

The test shows that using a specific composition (from Asics) on different shoes with different treads consistently proves to be the best.",1,Reddit (r/RunningShoeGeeks),Nike,RED_3039
"The absolute worst traction shoe I own is the ASICS Superblast, so this list is confusing.  Were you able to test for different surface types like aggregates and others?",1,Reddit (r/RunningShoeGeeks),Nike,RED_3040
"I'm curious if you're using Superblast 1 or 2? 

* Superblast 1: 0.33 (not good)
* Superblast 2: 0.83 (great)

Many previous versions, prior to ASICSGRIP, had bad traction",2,Reddit (r/RunningShoeGeeks),Nike,RED_3041
"1, so those results make a lot of sense.  Good they fixed it for 2.  Those shoes were not working for me at all in the PNW.",1,Reddit (r/RunningShoeGeeks),Nike,RED_3042
it's really hard to take these results seriously,0,Reddit (r/RunningShoeGeeks),Nike,RED_3043
"This is not an Evo SL competitor. Theyve even said its purely an easy run shoe.

Still dont understand the position on this one. Youve got the 1080v15. I guess thats the premium daily and this is the normal.

But still, just sounds like a rebranded 1080v14 with a new upper.

Love the look though if being honest.",79,Reddit (r/RunningShoeGeeks),Nike,RED_3044
"Technically they already have the ""normal daily"" with Fresh Foam. It's the 880. ",44,Reddit (r/RunningShoeGeeks),Nike,RED_3045
"New Balance is slowly making all of their shoes 'lifestyle shoes'. Have a friend who works there, and it's getting interesting internally, he said. ",13,Reddit (r/RunningShoeGeeks),Nike,RED_3046
"Are you sure? The 1080 v15 just took quite a big step in the running direction, away from lifestyle like the v13 and 14 were. They gave it firmer foam with more energy return.",8,Reddit (r/RunningShoeGeeks),Nike,RED_3047
"Depends who you listen to, have you tried it? The one YouTube shoe reviewer I pay any attention to said it feels more like a lifestyle/walking shoe than any 1080 before it.",1,Reddit (r/RunningShoeGeeks),Nike,RED_3048
"Oh interesting,  which youtuber is that?",1,Reddit (r/RunningShoeGeeks),Nike,RED_3049
"[https://www.youtube.com/@BenParkes](https://www.youtube.com/@BenParkes) 

Just because he has almost the exact same foot strike and running style as me I find I have nearly identical results with shoes. I haven't tried the 1080v15 myself though, I'm sure it's comfortable but there's so many good shoes around at the moment.",3,Reddit (r/RunningShoeGeeks),Nike,RED_3050
They kinda look like a shoe that will have  a comeback in 20 years like 2000s runners have right now as a lifestyle shoe. Especially the second colerway.,3,Reddit (r/RunningShoeGeeks),Nike,RED_3051
"This is exactly how I feel, everything feels the exact same lol. Like we get it, you have daily trainers and walkng shoes.

The only good thing New Balance put out in the last 2 years was the More and SuperComp Elite updates. I really wish they would shift their product lines away from ""everyday comfort"".",3,Reddit (r/RunningShoeGeeks),Nike,RED_3052
Rebel V5 are amazing to be fair the sc line is great tbf.,6,Reddit (r/RunningShoeGeeks),Nike,RED_3053
"Agree to disagree on the Rebel v5, I hated the updates to the original lower stack, firmer fuel cell midsole.

But yes the SC line is probably new balances best proposition.",2,Reddit (r/RunningShoeGeeks),Nike,RED_3054
Why change the 1080 foam then come out with a 1080 foam with less stack and call it something else?,36,Reddit (r/RunningShoeGeeks),Nike,RED_3055
Yeah isnt this is just the 1080 v15 but with the old fresh foam instead of the new infinion foam or whatever?,20,Reddit (r/RunningShoeGeeks),Nike,RED_3056
"Supwell had leaks of this shoe many months ago. I'm guessing they got fairly far along in developing this as the v15 before they decided to pivot that model, and then (similar to the Balos) decided to launch this alongside it rather than eat the R&amp;D. ",5,Reddit (r/RunningShoeGeeks),Nike,RED_3057
"Thats right, I do remember seeing early leaks of this. They should have kept the 1080 v15 with fresh foam and use Infineon for this model. That way people would be interested to try out this new model with a new foam. Either way the current nb running line up just feels a little behind compared to competitors.",8,Reddit (r/RunningShoeGeeks),Nike,RED_3058
"but no brand does that. If they did that, everyone would just wonder why the high end trainer doesn't have the newest foam. I mean, can you name a brand that puts their newest foam in their midlevel trainer before their high end one?",4,Reddit (r/RunningShoeGeeks),Nike,RED_3059
"Oh yeah, Im an idiot I forgot the 1080 is like 180 bucks now. Ill shut up now lol",3,Reddit (r/RunningShoeGeeks),Nike,RED_3060
This is 100% not the case. This was presented to retailer 7-8 months ago at the same time as the updated 1080. NB are targeting a different customer to who would normally buy theb1080,3,Reddit (r/RunningShoeGeeks),Nike,RED_3061
Whats the customer differentiator in your mind? The Ellipse is more attractive to me as a long-time 1080 fan.,1,Reddit (r/RunningShoeGeeks),Nike,RED_3062
"The 1080 has always been billed as the 'one shoe New Balance would sell if they could only sell one shoe', which means it has to be the do-it-all in the running line up. In today's running shoe landscape, that means it needs to compete with super trainers, hence the switch to super-critical foam. The ellipse might be targeting long time fans of freshfoam as the 1080 evolves.",3,Reddit (r/RunningShoeGeeks),Nike,RED_3063
"Isn't the rebel already a competitor for the evo sl? Or rather kinda the opposite, the evo sl made to compete with the rebel",58,Reddit (r/RunningShoeGeeks),Nike,RED_3064
No real competition there imo,22,Reddit (r/RunningShoeGeeks),Nike,RED_3065
How so? I've tried both in stores and felt like i might prefer the rebel cause the evo sl felt too unstable laterally,10,Reddit (r/RunningShoeGeeks),Nike,RED_3066
Wouldnt that be the Saucony azura?,6,Reddit (r/RunningShoeGeeks),Nike,RED_3067
"Not really sure why NB didnt put their new Infinion foam in this while keeping Fresh Foam in the 1080.

Nothing they do outside of the Fuelcell line makes any sense.",15,Reddit (r/RunningShoeGeeks),Nike,RED_3068
Well thats boring,27,Reddit (r/RunningShoeGeeks),Nike,RED_3069
They just cant quit that EVA.,30,Reddit (r/RunningShoeGeeks),Nike,RED_3070
"Fresh Foam is the best EVA in the market. Unparalleled still in terms of comfort and performance.

Only con is that it dies at 400km",4,Reddit (r/RunningShoeGeeks),Nike,RED_3071
my More trail V3 was good for 1100 km,3,Reddit (r/RunningShoeGeeks),Nike,RED_3072
"850km for me in the 1080 v13, most mileage I've ever got out of a shoe.",2,Reddit (r/RunningShoeGeeks),Nike,RED_3073
"100% my V13s made me question if I even understood when to change shoes as they lasted so long. My V14s are at 640 km and I am starting to notice them feeling a little flat but no doubt will still top 700 KM minimum. 

Conflicted on the elipse as I did love the 1080's foam but historically I find heal drops greater that 6mm irritating (aware this may be in my head as it feels picky to quibble over 2mm difference in drop but to me 6 and below always has felt better). Think i will stick to the (expensive...) 1080's before trying the elipse - just wish the upper of the 1080 looked like this - these are beautiful!",1,Reddit (r/RunningShoeGeeks),Nike,RED_3074
"The softer versions of FF die too soon, the firmer versions are just just blah.  I would argue Saucony PWRN is better overall, firmer but last longer and is better at faster paces.  PWRN might be a blend though. 

FF better for walking, better for easy paces. ",1,Reddit (r/RunningShoeGeeks),Nike,RED_3075
"Fresh Foam is good. If it aint broke, dont fix it.",2,Reddit (r/RunningShoeGeeks),Nike,RED_3076
Its good but it dies way too quick imo,15,Reddit (r/RunningShoeGeeks),Nike,RED_3077
So they are only good when fresh?,21,Reddit (r/RunningShoeGeeks),Nike,RED_3078
![gif](giphy|wrBURfbZmqqXu),10,Reddit (r/RunningShoeGeeks),Nike,RED_3079
That's the reason behind the name,2,Reddit (r/RunningShoeGeeks),Nike,RED_3080
Doesnt really make me want to spend $140 on them,7,Reddit (r/RunningShoeGeeks),Nike,RED_3081
Especially when other shoes in the same price range have better super critical foams. Heck even the Skechers aero razor at 140 has ATPU midsole. Insane,4,Reddit (r/RunningShoeGeeks),Nike,RED_3082
"Well the Razor isn't in the same category of running shoes. One is a eva foam daily trainer, while the other is a carbon plated A-TPU speed day shoe and cheap race day shoe. They are the same because they are both running shoes. That's about it",3,Reddit (r/RunningShoeGeeks),Nike,RED_3083
"Price point is the exact same. Also has very similar stack height. I get they may be for slightly different purposes but was just pointing out for the cost, you get more from another shoe that could fill a similar role. Also carbon plate is a loose term lol. I have a pair fyi",1,Reddit (r/RunningShoeGeeks),Nike,RED_3084
"I mean I can pick up a pair of basketball shoes for that price doesn't mean I'm doing the same thing in them.

Also early reviews are saying the Razer is already on people's shoe of the year lists. This NB isn't going to be on any list. =",1,Reddit (r/RunningShoeGeeks),Nike,RED_3085
"Interestingly, this has never been my experience. I've gotten many, many more miles out of the last few iterations of the 1080 than just about any other shoe. ",2,Reddit (r/RunningShoeGeeks),Nike,RED_3086
Yes for the first 150km they are great,5,Reddit (r/RunningShoeGeeks),Nike,RED_3087
"Rebel v2, v3 were dynamic, springy, fun shoes. They bumped its stack, but didn't realize that its lower profile added dynamism and livelines. Max cushioned Rebel v5 is now just plain soft and slow. Thus, NB essentially no longer have daily shoes with tempo run capacity. Even 1080 entered the realm of max stack. What to do? Here we have yet another moderate stack model with questionable performance.",8,Reddit (r/RunningShoeGeeks),Nike,RED_3088
"Not just increasethe stack, it's a completely different foam.",2,Reddit (r/RunningShoeGeeks),Nike,RED_3089
No contradiction with what I said.,2,Reddit (r/RunningShoeGeeks),Nike,RED_3090
I ran in the Rebel v4 as one of my first running shoes and absolutely loved it for tempo sessions and the treadmill; it also lasted forever. I cannot even consider using the Rebel v5 for those purposes.,2,Reddit (r/RunningShoeGeeks),Nike,RED_3091
"The rebel V2 was great, durability was a bit suspect. I had two pairs and the upper tore in one ( I super glued it) and the other pair were fine. They were really fun shoes and I've never found anything to match them since. The Evo SL is fun too but not on the same level.",1,Reddit (r/RunningShoeGeeks),Nike,RED_3092
"Everything I've heard about this shoe is that it's more of gym/running/lifestyle shoe. 
Trying to cater to that crowd",1,Reddit (r/RunningShoeGeeks),Nike,RED_3093
"Let's recap:

Weighs more (273g) than a Novablast, costs more than an EVO SL.

Has 8mm drop instead of the usual mid drop in New Balance shoes. 



I take back what I said - there is no chance I will be buying this shoe. ",10,Reddit (r/RunningShoeGeeks),Nike,RED_3094
Looks more like a Supernova competitor.,4,Reddit (r/RunningShoeGeeks),Nike,RED_3095
What is the NB equivalent to a Neo Zen or AG4 (even Evo or vom plus) at this point?  Something fairly plush but fun/bouncy?  The Balos?,5,Reddit (r/RunningShoeGeeks),Nike,RED_3096
"I believe I read that there wont be another Balos, as the sales of version 1 were disappointing, unfortunately.",5,Reddit (r/RunningShoeGeeks),Nike,RED_3097
For 200$ and over 200¬ =D,5,Reddit (r/RunningShoeGeeks),Nike,RED_3098
"A bunch of them ended up at a local Winners (TJ  group outlet here in Canada) recently and they did clear out pretty fast once they were knocked down to a reasonable price (I dont recall what they were priced at, might have been at $100 CAD)& it just cost way too much.",3,Reddit (r/RunningShoeGeeks),Nike,RED_3099
Try the new 1080,1,Reddit (r/RunningShoeGeeks),Nike,RED_3100
Affordable daily trainer? $140 a bit steep. Would like to see these legacy technology trainers priced closer to that 120 or 110 price point. Maybe angled as a softer alternative to the 880.,13,Reddit (r/RunningShoeGeeks),Nike,RED_3101
"The adidas outlet is overflowing with $99 evos. I agree $140 is steep, these will end up on a 2 for $100 deal on joes",22,Reddit (r/RunningShoeGeeks),Nike,RED_3102
"This is why I always buy the outgoing model or at least am patient and wait for sales.

I recently bought a pair of 1080 v14s for $81.

I ordered a pair of EVO SLs for $90 when Adidas had a big sale back in December.

I got two pairs of shoes for just a bit more than what either one of them would have cost individually at msrp.

Paying full msrp for running shoes is silly.",14,Reddit (r/RunningShoeGeeks),Nike,RED_3103
"Agree, all my running shoes I paid for below retail.",4,Reddit (r/RunningShoeGeeks),Nike,RED_3104
this is a 1080v14/15 with a run club upper. thats all it is,4,Reddit (r/RunningShoeGeeks),Nike,RED_3105
"Looks to compete with Novablast, providing an alternative to the 880. Similar approach that ASICS took with Novablast as a modern alternative to Cumulus. This allows them to stay relevant to current trends without disappointing loyalists of their legacy models. Though, to points already made, NB may not have gone far enough to position this as a modern daily trainer, unless they reformulated the foam to be bouncy like they did with the Balos which was a banger.

Rebel is positioned as a tempo shoe, which is a better comparison to Evo SL",5,Reddit (r/RunningShoeGeeks),Nike,RED_3106
