text,rating,source,brand,doc_id
"Thank you for this data. 

Adidas Prime X &amp; X2, Adidas Boston 12, Mizuno Neo Vista, Mizuno Wave Rebellion Pro 2 &amp; 3 will be great to see as well. 

Is this testing the heel specifically, or the forefoot as well?",5,Reddit (r/RunningShoeGeeks),Nike,RED_2308
"The data in the original post is for the heel. We will of course also be testing the forefoot. Attached is a correlation between heel (x) and forefoot (y) energy return. 

Shoes: added to the list

https://preview.redd.it/tn0rlcb7p8re1.png?width=568&amp;format=png&amp;auto=webp&amp;s=47ba3b03e3453e93a94ef80fe4c21b094565c358",3,Reddit (r/RunningShoeGeeks),Nike,RED_2309
"Thanks! I look forward to it. 

Any chance you could add labels to these correlation data points?",1,Reddit (r/RunningShoeGeeks),Nike,RED_2310
Added a new comment with the exact numbers here: [https://www.reddit.com/r/RunningShoeGeeks/comments/1jl2xas/comment/mk0jo6m/?utm\_source=share&amp;utm\_medium=web3x&amp;utm\_name=web3xcss&amp;utm\_term=1&amp;utm\_content=share\_button](https://www.reddit.com/r/RunningShoeGeeks/comments/1jl2xas/comment/mk0jo6m/?utm_source=share&amp;utm_medium=web3x&amp;utm_name=web3xcss&amp;utm_term=1&amp;utm_content=share_button),1,Reddit (r/RunningShoeGeeks),Nike,RED_2311
"Firstly, runrepeat is the number 1 reason I got into running and buying a first pair of running shoes. Absolutely love the way it's broken down and presented. Anyone who will ever ask about running shoes, I'm sending them straight there.

This would be really interesting over time to have in terms of categories I feel. Not sure if it's already been mentioned, but how you lot have that comparison thing on your site with different shoes, having this metric added to it would be very cool.",4,Reddit (r/RunningShoeGeeks),Nike,RED_2312
"Deviate Nitro 2 and 3

Rebel v3 and v4

Adizero SL2",5,Reddit (r/RunningShoeGeeks),Nike,RED_2313
All on the list for batch 1,3,Reddit (r/RunningShoeGeeks),Nike,RED_2314
"In addition to the requests that have/will inevitibly float to the top here, I'm curious to see how the Mizuno foams do, particularly the TPU found in the Neo Zen.",5,Reddit (r/RunningShoeGeeks),Nike,RED_2315
Added to batch 1,1,Reddit (r/RunningShoeGeeks),Nike,RED_2316
"So is this just testing the foam, rather than the whole shoe mechanism ?",6,Reddit (r/RunningShoeGeeks),Nike,RED_2317
"Testing anything between your foot and the ground. Many factors are NOT considered as running is complicated. Best metric of all would be running efficiency, but there will be too many influencing factors for us to consider at this point.",4,Reddit (r/RunningShoeGeeks),Nike,RED_2318
"Was more so a question of does this just test the foam, or does it also test how the plate interacts etc. based on the photo of the machine I assume its just testing the foam. I understand the difficulty of testing beyond, but was curious if any of those other factors played into the finding or if it was strictly foam. ",1,Reddit (r/RunningShoeGeeks),Nike,RED_2319
You're right,1,Reddit (r/RunningShoeGeeks),Nike,RED_2320
"Yeah, the graph by itself can be misleading without this context. A plate will provide more energy return in a way that this test wouldn't be able to show.",6,Reddit (r/RunningShoeGeeks),Nike,RED_2321
I was thinking the same thing. The volume / surface area of the sole is a massive variable,1,Reddit (r/RunningShoeGeeks),Nike,RED_2322
"Whoa, very cool data!",3,Reddit (r/RunningShoeGeeks),Nike,RED_2323
Is this only testing the heel?,3,Reddit (r/RunningShoeGeeks),Nike,RED_2324
"We will of course be testing the forefoot properties as well. Here's energy return for heel (x-axis) vs forefoot (y-axis) for the mentioned shoes

https://preview.redd.it/htmcssowl8re1.png?width=568&amp;format=png&amp;auto=webp&amp;s=ab62065002bba1e5ad8c32b325d66ba8508768b4",3,Reddit (r/RunningShoeGeeks),Nike,RED_2325
"Am I reading this right, the AP4 is better than the AF3? As someone whos about to buy one of the other this would be good to dissect!",3,Reddit (r/RunningShoeGeeks),Nike,RED_2326
"That may be how the foam performs but in practice, both shoes have different feels/mechanics that are also larger parts of the picture.Such as the Airpods in the AF3, the plate/rods configuration, rocker placement ec.
Fwiw the AF3 is perfection.",1,Reddit (r/RunningShoeGeeks),Nike,RED_2327
"Ive heard at slower speeds the AF3 can be a real pain on the feet whereas the AP4 is still relatively comfortable. Im running my first ever marathon in April, just want to be prepared for IF I hit that wall and really struggle for the last 10 or so K",2,Reddit (r/RunningShoeGeeks),Nike,RED_2328
"Gotcha. I'd definitely want to get some practice runs at various paces with any shoe before the day of the marathon. 
Personally, the AF3 works at any pace, it definitely gets lively and chaotic (in a good way) when you push paces around 7 min per mile or under. That said, I haven't really noticed it giving any issues at 9 min per mile paces or anything around that. It does feel kind of mechanical, in that it's not the most natural shoe to run in if that makes sense. FWIW, that shoe reviewer on YT EddBud said similar thigns in his review of the AF3. 
The AF3 is also incredibly protective in my experience. Long runs really don't seem to beat up the legs with them as some other shoes do. 
Word of warning though. The clopping. My god they make an obnoxious clopping noise that sounds like a horse is galloping down the road. The AP4's on the other hand have a loud squeak when walking, but I didn't notice it much when running. 
But everything is all dependent on running mechanics, etc.",2,Reddit (r/RunningShoeGeeks),Nike,RED_2329
"Yeah I get it, going to order the AP4, should arrive mid week and got 32k to nail as my final long run so will get that done in them and sling one of my speed runs in there for good measure",2,Reddit (r/RunningShoeGeeks),Nike,RED_2330
"Nobody has mentioned trail shoes! Id be really curious to see La Sportiva Prodigio Pro, Norda 005, Adidas Agravic Speed Ultra, Hoka Tecton X3, Nnormal Kjerag/Kboix, Nike Ultrafly/Zegama& just off the top of my head here. Thanks!",3,Reddit (r/RunningShoeGeeks),Nike,RED_2331
All added to the list (except kboix - will be batch 2). All the best from another trail runner,3,Reddit (r/RunningShoeGeeks),Nike,RED_2332
"Boston 12 and superblast 2, nice data!",3,Reddit (r/RunningShoeGeeks),Nike,RED_2333
New Balance SuperComp Elite v4,3,Reddit (r/RunningShoeGeeks),Nike,RED_2334
"While I do agree that the graph doesn't tell the whole story as weight, geometry, and stiffening agents do affect running performance when you factor all of them in, this should give us the basic idea of how ""bouncy"" the shoes are on paper. Not to mention, proper form and technique are required to get the most out of these shoes.",3,Reddit (r/RunningShoeGeeks),Nike,RED_2335
Any information about the Adios Pro 3 or SB 1/2 ?,2,Reddit (r/RunningShoeGeeks),Nike,RED_2336
Imagine ap3 would be very similar to the Evo sl results ,4,Reddit (r/RunningShoeGeeks),Nike,RED_2337
"Over the last few days, i've mostly done my runs in the Pro 3 (after running mostly with two pairs of Evo SL for two months). I had to make a few tweaks (changing the laces and adding a tongue pad). I'm really impressed with the Pro 3 after 90 km now,  the rods provide better stability than the EVO. I'm seriously considering getting a pair a half size bigger (on sale) for my longer runs this year.",1,Reddit (r/RunningShoeGeeks),Nike,RED_2338
"Unfortunately, we only have the above-mentioned shoes tested so far. But we will definitely include this",3,Reddit (r/RunningShoeGeeks),Nike,RED_2339
"Apart from the upper, I think the AP3 makes a better trainer than the Evo. The Evo is just unwieldy and the ap3 is very focus and does whatever you asked of it ",2,Reddit (r/RunningShoeGeeks),Nike,RED_2340
Ouhhhh cant wait to see data on the other brands and shoes,2,Reddit (r/RunningShoeGeeks),Nike,RED_2341
"This is very cool. I've personally run in Pegasus 39 and 41, Novablast 5, and Solarboost 5. I can confirm that the shock attenuation feels exactly as the test shows. Novablast 5 is very well cushioned and I don't feel as much impact while Pegasus 39 definitely has much more ground feel and I can feel the impact on my shins. 


On the other hand, I haven't really noticed much difference in energy return. In fact, I felt like Pegasus 41 had marginally higher energy return than Novablast 5.",2,Reddit (r/RunningShoeGeeks),Nike,RED_2342
It's great to hear some real-life experiences - I appreciate you sharing.,2,Reddit (r/RunningShoeGeeks),Nike,RED_2343
"Very very interesting! Bravo! 
Could you please add some Mizuno shoes, maybe Wave Rider, Neo Vista and Neo zen? Your research needs to be applauded very widely!",2,Reddit (r/RunningShoeGeeks),Nike,RED_2344
Just added them - not the first to mention the Neo's,1,Reddit (r/RunningShoeGeeks),Nike,RED_2345
Amazing! Thanks!!,1,Reddit (r/RunningShoeGeeks),Nike,RED_2346
"You just convinced me to buy Evo SL on Full price. Still hesitating, would love to get Saucony EP4 around $140.",2,Reddit (r/RunningShoeGeeks),Nike,RED_2347
New Balance 1080 por favor!,2,Reddit (r/RunningShoeGeeks),Nike,RED_2348
"Can't miss that one, that's for sure",1,Reddit (r/RunningShoeGeeks),Nike,RED_2349
"Here are two data points: the Topo Specter 2 bottoms out at power outputs between 450470 watts, with a cadence ranging from 190 to 200 steps per minute and a body weight of 76 kg. Similarly, the NB Rebel v4 bottoms out between 430453 watts. These observations were recorded during a fartlek and a threshold interval session. The runner is a midfoot striker.",2,Reddit (r/RunningShoeGeeks),Nike,RED_2350
"Vomero 18, Bondi 9, Glycerin Max& who is the max cushion champion?",2,Reddit (r/RunningShoeGeeks),Nike,RED_2351
"Good input. Everyone talking about energy return, but who's the cush champ? Let's find out",4,Reddit (r/RunningShoeGeeks),Nike,RED_2352
"Would love to see the saucony endorphins, hoka mach x2 and Mach 6, and NB Elite 4.",2,Reddit (r/RunningShoeGeeks),Nike,RED_2353
"All added, thank you",3,Reddit (r/RunningShoeGeeks),Nike,RED_2354
adidas adios pro 3,2,Reddit (r/RunningShoeGeeks),Nike,RED_2355
love your website. it's been a game changing reference for not just running shoes for all shoes,1,Reddit (r/RunningShoeGeeks),Nike,RED_2356
On the list!,1,Reddit (r/RunningShoeGeeks),Nike,RED_2357
i only see AP4?,1,Reddit (r/RunningShoeGeeks),Nike,RED_2358
"I think it would be great if you could make one for each category , such as one for max cushion involving Gel Nimbus, NB 1080",2,Reddit (r/RunningShoeGeeks),Nike,RED_2359
Will definitely do,1,Reddit (r/RunningShoeGeeks),Nike,RED_2360
"I see EVO SL, I upvote =O<ü",2,Reddit (r/RunningShoeGeeks),Nike,RED_2361
Bro I love ur website ty so much,2,Reddit (r/RunningShoeGeeks),Nike,RED_2362
"Question: Does this include whatever sockliner is supplied with the shoe? I find swapping sockliners between shoes can totally change the character of the shoe for better or worse. If I put a Saucony Powerrun Pb liner into my ASICS Noosa Tri 15, it maintains the attenuation but helps with energy return massively. If I put it into an OG Topo Specter, it improves attenuation and return. If I put it into my Arahi 6, it is absolutely awful, where I feel like I slam through the sockliner into the firm foam of the arahi.",2,Reddit (r/RunningShoeGeeks),Nike,RED_2363
We've decided to keep the sock liner included as 99% of runners don't swap them out. We did find significantly different results with/without the sock liner included,1,Reddit (r/RunningShoeGeeks),Nike,RED_2364
"I have experimented with this over the last few weeks - took my ride sockliner and put it into the ES3.  Felt so much comfier. 

I guess I wasnt on to too radical an idea,  Im going to try this more often. 

Ive used ES3 sockliner in the past in my Puma DN2, because on hotter days my hallux complains more than on cold days in the DN2.  Helped somewhat and only did it because I like the look of my DN2 and have been forced to relegate it to a walking shoe.",1,Reddit (r/RunningShoeGeeks),Nike,RED_2365
"This is great!!

I would love to see some trail running shoes... Maybe some of the Asics Gel Trabuco lineup. Would also be interested to see how the Endorphin Rift stacks up against the road versions given that it deletes nylon/carbon plates for a rock plate.  It would also be cool to see them next to the Peregrine etc, even though they are technically for vastly different types of terrains.  Still hoping Saucony releases the V2 SOON - my Rifts are on the way out with over 400km on them!

It would be so cool users could create charts like these where the data was available on runrepeat...  I love looking at charts like these!!",2,Reddit (r/RunningShoeGeeks),Nike,RED_2366
"Noted, and will add those shoes incl more trail shoes",2,Reddit (r/RunningShoeGeeks),Nike,RED_2367
"Wow, really cool data!  Ive done a lot of elastomer testing for oilfield applications.  Have you considered high cycle fatigue testing on the different foam compounds, and plate combinations?  It would be interesting to see how these initial results deteriorate over load cycles.

  
Had to do some searching to find the standard although I don't want to pay the $70 to read it:  ASTM F1976-24 Standard Test Method for Impact Attenuation of Athletic Shoe Cushioning Systems and Materials.

  
Personally I would like to see how the Zoom fly 6 stacks up against more expensive shoes.",1,Reddit (r/RunningShoeGeeks),Nike,RED_2368
"Zoom fly: added! 

We will run a compression set to simulate 'fatigue/durability' of the midsole. Not exactly as you suggest, but similar",3,Reddit (r/RunningShoeGeeks),Nike,RED_2369
"So this is just the testing of the foam. It doesn't factor in the motion of running and how the plate in a shoe adds to the shoe returning energy, correct?",1,Reddit (r/RunningShoeGeeks),Nike,RED_2370
"That is correct. How efficient the shoe is to you is way more complicated than this mechanical test of energy return. Today, the focus on energy return is massive, maybe even hyped.",2,Reddit (r/RunningShoeGeeks),Nike,RED_2371
Understood. Thanks!,1,Reddit (r/RunningShoeGeeks),Nike,RED_2372
"Would love to see the Puma Deviate Nitro Elite 3, and Saucony Endorphin Pro 4.",1,Reddit (r/RunningShoeGeeks),Nike,RED_2373
Absolutely. Added!,3,Reddit (r/RunningShoeGeeks),Nike,RED_2374
"FuelCell SuperComp Elite 4, please!",1,Reddit (r/RunningShoeGeeks),Nike,RED_2375
Added to batch 1,2,Reddit (r/RunningShoeGeeks),Nike,RED_2376
"Would be great to see that compared to the New Balance  Rebel V4. I tested the Rebel V4 against Adios Pro 4 at the adidas run lab recently and it said the Rebel v4 had higher energy return for me in that test which I find odd. I  also need to say I love runpeat, your review data are unmatched and as a member of the wide foot community, my feet live and die by your toe box width measurements :)",1,Reddit (r/RunningShoeGeeks),Nike,RED_2377
YES! Love to hear it when people love new tests we've implemented. That improved width test took 6 months to implement.,2,Reddit (r/RunningShoeGeeks),Nike,RED_2378
Superblast 2 and Balos please!,1,Reddit (r/RunningShoeGeeks),Nike,RED_2379
"Those are absolutely necessary, agree! Added to batch 1",3,Reddit (r/RunningShoeGeeks),Nike,RED_2380
I would be most interested to find out the results of new shoes vs a pair that has 200 miles+. Especially in PEBA midsoles.,1,Reddit (r/RunningShoeGeeks),Nike,RED_2381
"We will test that later in 2025 with another machine that we bought. I think this is very relevant and not many studies has been made on this topic. Hopefully our data will be helpful, when we get there",6,Reddit (r/RunningShoeGeeks),Nike,RED_2382
This does not seem accurate if you are only compressing the foam of the shoe and not bending the shoe dynamically,1,Reddit (r/RunningShoeGeeks),Nike,RED_2383
"I agree. This is an approximation, but energy usage when running is many fold more complicated than this mechanical test.",2,Reddit (r/RunningShoeGeeks),Nike,RED_2384
On cloudboom strike,1,Reddit (r/RunningShoeGeeks),Nike,RED_2385
Added! We have it already in the lab and it will come in batch 1,2,Reddit (r/RunningShoeGeeks),Nike,RED_2386
"How much of the plate or rods are impactful in these tests, and if any I would be curious to add the Adios Pro 3 in the list to compare with the Evo SL.",1,Reddit (r/RunningShoeGeeks),Nike,RED_2387
"The test has its limitations, and not every parameter of the shoe is considered. It's an 'estimation', let's say. Best would be to measure actual runners efficiency, but that complicates things quite a LOT",1,Reddit (r/RunningShoeGeeks),Nike,RED_2388
"All the super max cushioned shoes pls!
Also the chinese brands like Anta,361 degrees,Qiaodan,etc",1,Reddit (r/RunningShoeGeeks),Nike,RED_2389
"This is the first comment where I will not add the mentioned shoes. We haven't tested shoes from any of the brands mentioned and it's very costly to us as we buy all shoes with our own money - and frankly, not too many are interested in those shoes. I'm so sorry, but these will not be added to the first batch. I will however be sure to include lots of max cushioned shoes",1,Reddit (r/RunningShoeGeeks),Nike,RED_2390
"Very cool! Would love to see

Nike streakfly 2

Nike zoom fly 6

Some sort of distance spike if you're able to test them; dragonfly 2, dragonfly 2 elite, victory 2, etc.",1,Reddit (r/RunningShoeGeeks),Nike,RED_2391
"Yes, we'll include the spikes as well to the degree possible. Added!",1,Reddit (r/RunningShoeGeeks),Nike,RED_2392
"Would be interesting to see how the most popular super trainers compare to the most popular race shoes compare to the most popular illegal shoes (Prime Strung X2, Skyward X). As much as I love my daily trainers I think most of us buy them for value, comfort and durability rather than energy return. Would be really interesting though to know how the Endorphin Speed compares to the Endorphin Pro compares to the Endorphin Elite, and same for other brands lineups.",1,Reddit (r/RunningShoeGeeks),Nike,RED_2393
"I much agree here. Comparing shoes from the same lineup, as well as previous iterations. That will be fun!",1,Reddit (r/RunningShoeGeeks),Nike,RED_2394
Interesting that EVO SL and Adios Pro 4 were so close in results given the price variance. I have the EVO SL and absolutely love them.,1,Reddit (r/RunningShoeGeeks),Nike,RED_2395
"We ourselves praised the EVO SL a lot in our review. We rarely use words such as ""We really believe that the Adidas Adizero EVO SL has the potential to transform the running shoe industry. """,2,Reddit (r/RunningShoeGeeks),Nike,RED_2396
Honestly I'd be curious to see lower end trainers tested as well. Throw some Brooks Adrenaline GTS in there to see just how different the data is for different shoes on the price spectrum.,1,Reddit (r/RunningShoeGeeks),Nike,RED_2397
"Absolutely. As an owner of the Adrenaline series myself, I'm curious to see how the stack up. However, you're not saying the adrenaline are 'lower end trainers' are you? I assume you have two requests right - one for lower end/budget and then also the Adrenaline?",1,Reddit (r/RunningShoeGeeks),Nike,RED_2398
"Seeing everyone recommended carbon plat d shoes and super shoes in this subreddit has just made me feel like pleb because I've always run in the Adrenaline GTS since the 13s!

I've felt like a 2nd class citizen next to these $200 shoes that people throw around! It really was a poor choice of words because the GTS are a fantastic shoe that I've gotten upwards of 400 miles on per pair.

I'm just curious about shoes that are on the opposite end of the super shoe/carbon shoe spectrum.",1,Reddit (r/RunningShoeGeeks),Nike,RED_2399
All daily trainers will be tested as well. People are just most interested in how super shoes perform - at least when it comes to energy return. That's why you're seeing more of those in this first post I made,1,Reddit (r/RunningShoeGeeks),Nike,RED_2400
=_Prime X Strung 2 would be very interesting - is it as bouncy as it feels or is it not worth its weight?!,1,Reddit (r/RunningShoeGeeks),Nike,RED_2401
Absolutely added,2,Reddit (r/RunningShoeGeeks),Nike,RED_2402
Are you planning on including this in a new testing methodology for runrepeat?,1,Reddit (r/RunningShoeGeeks),Nike,RED_2403
"Absolutely. We have four new machines in the lab - this is just one of them. However, it takes a lot of time to re-test so many shoes, so please bare with us",2,Reddit (r/RunningShoeGeeks),Nike,RED_2404
Thats great! Thank you!,1,Reddit (r/RunningShoeGeeks),Nike,RED_2405
"I am not one to argue with data, as data are what they are, but man, I can't believe the RocketX2 and Alphafly are so similar.  I have both and run in both, gone through multiple pairs of both, and would not guess that.

Thanks for sharing.",1,Reddit (r/RunningShoeGeeks),Nike,RED_2406
"I have the Alphafly (1,2&amp;3) and the shock to my sheen is the highest.. ",2,Reddit (r/RunningShoeGeeks),Nike,RED_2407
"This could be one of the examples where this testing method (SATRA TM142) has its limitations. What I've learned from visiting labs and tested almost 900 shoes is that the more we know, the more we know we don't know. It's all complicated, and one number rarely tells the entire story.",2,Reddit (r/RunningShoeGeeks),Nike,RED_2408
Very curious to see how the Metaspeed Sky and Edge would compare versus the other super shoes on here! Also would be curious to see the new S4+ Yogiri,1,Reddit (r/RunningShoeGeeks),Nike,RED_2409
Will be added.,1,Reddit (r/RunningShoeGeeks),Nike,RED_2410
Though I feel there's soon coming a replacement of the Sky/Edge,1,Reddit (r/RunningShoeGeeks),Nike,RED_2411
"I'd love to see the Prime X Strung v1 as well as Prime X Strung 2 listed. 

I know the first is an older shoe, but it has become somewhat of a grail purchase for many who insist its bounce is unmatched in later models. It would be very interesting to see if that hype is justified and if Adidas has managed to improve on what they had years ago.",1,Reddit (r/RunningShoeGeeks),Nike,RED_2412
"We still have it in the lab, so I'll make sure to include it",1,Reddit (r/RunningShoeGeeks),Nike,RED_2413
New Balance Rebel v4,1,Reddit (r/RunningShoeGeeks),Nike,RED_2414
Not the first to mention this one. It has been added,1,Reddit (r/RunningShoeGeeks),Nike,RED_2415
"Nike Vomero 18, they are really cushioned , but really interested on what return looks like",1,Reddit (r/RunningShoeGeeks),Nike,RED_2416
"A sure candidate for the best cushioning, we'll see.",1,Reddit (r/RunningShoeGeeks),Nike,RED_2417
"Very cool information. Thank you very much for sharing.

Now please, earth, world, stop trying to make me buy a pair of EVO SL. I really shouldn't.

Thank you.",1,Reddit (r/RunningShoeGeeks),Nike,RED_2418
Just Do It >å,2,Reddit (r/RunningShoeGeeks),Nike,RED_2419
"Honestly, if Adidas wasn't so damn weird with the release of this shoe I probably already own it.

If something, this tactic has kept me away from it. 
You only need to stay strong on the small window of availability. The rest you just can't, at least until the next one.

Also, pretty goated rotation.",1,Reddit (r/RunningShoeGeeks),Nike,RED_2420
Yeah I was also annoyed about the way they did the releases. I got some vouchers for zalando though and then they became available so I went for it.,1,Reddit (r/RunningShoeGeeks),Nike,RED_2421
"Just came off a run on my Hoka Mach X 2's. The bounce on those feels better than my Alphafly 2's. I'd love to see them tested, but I reckon this comment might be too late to get noticed.",1,Reddit (r/RunningShoeGeeks),Nike,RED_2422
I do notice you! Added,1,Reddit (r/RunningShoeGeeks),Nike,RED_2423
"I still have the OG Puma deviate nitro elite and I'm surprised by how much lower the energy return data. Especially when that shoe came out it was one of the best racing shoe in the market, won a lot of trophies and medals.

  
It's probably because you have so little foam back of the heel and carbon plate sits basically under your feet which could explain the results.",1,Reddit (r/RunningShoeGeeks),Nike,RED_2424
"I own both the Adidas EVO SL and the Puma DNE og. The data matches how I feel when running with both shoes.

The DNE feels better in short speed intervals though, as is more like a racing flat.

The EVO SL is an absolute joy to run with (and the data is on point) but for short 200/400m I think their stack is way too high.

I'm curious about the Adios 9 though. That would be a good one to get data on.",1,Reddit (r/RunningShoeGeeks),Nike,RED_2425
"If the Nitro Elite feels like racing flat for you I have no idea how Adios 9 going to feel for you because there is at least 8mm stack height difference between those shoes.

I remember Nitro Elite was intented for half maraton to marathon distance. It was too much for 5to10k and takumi sen 8 was the king of 5 to 10k.",1,Reddit (r/RunningShoeGeeks),Nike,RED_2426
